src/perception/ros2_bevfusion_async/models/resnet50_v1/onnx_fp16/build/fuser.log
[11/13/2025-13:36:45] [V] [TRT] *************** Autotuning format combination: Float(10886400,32400,180,1) -> Float(8294400,32400,180,1) ***************
[11/13/2025-13:36:45] [V] [TRT] --------------- Timing Runner: Conv_1 + Relu_2 (CaskConvolution[0x80000009])
[11/13/2025-13:36:45] [V] [TRT] Tactic Name: ampere_scudnn_128x128_relu_small_nn_v1 Tactic: 0x503619c69ae500ff Time: 19.1619
[11/13/2025-13:36:45] [V] [TRT] Tactic Name: ampere_scudnn_128x128_relu_medium_nn_v1 Tactic: 0xf067e6205da31c2e Time: 17.1615
[11/13/2025-13:36:46] [V] [TRT] Tactic Name: ampere_scudnn_128x64_relu_xregs_large_nn_v1 Tactic: 0x5deb29b7a8e275f7 Time: 17.7266
[11/13/2025-13:36:46] [V] [TRT] Tactic Name: sm80_xmma_fprop_implicit_gemm_indexed_f32f32_f32f32_f32_nchwkcrs_nchw_tilesize128x64x8_stage2_warpsize2x2x1_g1_ffma_aligna4_alignc4_beta0_packed_stride Tactic: 0x31aa67f57c5aea77 Time: 19.4176
[11/13/2025-13:36:46] [V] [TRT] Tactic Name: sm80_xmma_fprop_implicit_gemm_f32f32_f32f32_f32_nchwkcrs_nchw_tilesize64x64x8_stage3_warpsize1x4x1_g1_ffma_aligna4_alignc4 Tactic: 0xa31d27de74b895ff Time: 16.7444
[11/13/2025-13:36:46] [V] [TRT] Tactic Name: sm80_xmma_fprop_implicit_gemm_indexed_f32f32_f32f32_f32_nchwkcrs_nchw_tilesize128x32x8_stage3_warpsize2x2x1_g1_ffma_aligna4_alignc4 Tactic: 0xa9366041633a5135 Time: 30.0057
[11/13/2025-13:36:46] [V] [TRT] Tactic Name: sm80_xmma_fprop_implicit_gemm_f32f32_f32f32_f32_nchwkcrs_nchw_tilesize64x128x8_stage3_warpsize1x4x1_g1_ffma_aligna4_alignc4 Tactic: 0x5aa723e0481da855 Time: 14.3756
[11/13/2025-13:36:47] [V] [TRT] Tactic Name: sm80_xmma_fprop_wngd_f32f32_f32_f32_nchwkcrs_nchw_tilesize8x16x32x8_warpsize8x1x1_wngd2x2 Tactic: 0xe47e164f4a743900 Time: 13.9462
[11/13/2025-13:36:47] [V] [TRT] Tactic Name: ampere_scudnn_128x64_relu_small_nn_v1 Tactic: 0x3f243c490d502deb Time: 16.9908
[11/13/2025-13:36:47] [V] [TRT] Tactic Name: sm80_xmma_fprop_implicit_gemm_f32f32_f32f32_f32_nchwkcrs_nchw_tilesize64x128x8_stage3_warpsize1x4x1_g1_ffma_t1r3s3_aligna4_alignc4 Tactic: 0x01cf8ce2da913006 Time: 14.4151
[11/13/2025-13:36:47] [V] [TRT] Tactic Name: sm80_xmma_fprop_implicit_gemm_f32f32_f32f32_f32_nchwkcrs_nchw_tilesize128x64x8_stage2_warpsize2x2x1_g1_ffma_t1r3s3_aligna4_alignc4_beta0_packed_stride Tactic: 0x3712e3e595645874 Time: 14.2686
[11/13/2025-13:36:47] [V] [TRT] Tactic Name: sm80_xmma_fprop_implicit_gemm_f32f32_f32f32_f32_nchwkcrs_nchw_tilesize32x32x8_stage3_warpsize1x2x1_g1_ffma_t1r3s3_aligna4_alignc4 Tactic: 0x8ad32616b1424be4 Time: 22.7497
[11/13/2025-13:36:47] [V] [TRT] Tactic Name: sm80_xmma_fprop_implicit_gemm_f32f32_f32f32_f32_nchwkcrs_nchw_tilesize64x64x8_stage3_warpsize1x4x1_g1_ffma_t1r3s3_aligna4_alignc4 Tactic: 0x4727434768e46395 Time: 16.3737
[11/13/2025-13:36:48] [V] [TRT] Tactic Name: sm80_xmma_fprop_implicit_gemm_f32f32_f32f32_f32_nchwkcrs_nchw_tilesize256x128x8_stage3_warpsize4x2x1_g1_ffma_t1r3s3_aligna4_alignc4 Tactic: 0x4efce38acc876f5c Time: 13.1445
[11/13/2025-13:36:48] [V] [TRT] Tactic Name: sm80_xmma_fprop_implicit_gemm_indexed_f32f32_f32f32_f32_nchwkcrs_nchw_tilesize128x64x8_stage2_warpsize4x1x1_g1_ffma_aligna4_alignc4_beta0_packed_stride Tactic: 0x1673e3594ce11cea Time: 20.6766
[11/13/2025-13:36:48] [V] [TRT] Fast skip Tactic:0x40a12e3938221818 which exceed time limit during pre-run
[11/13/2025-13:36:48] [V] [TRT] Tactic Name: sm80_xmma_fprop_implicit_gemm_indexed_f32f32_f32f32_f32_nchwkcrs_nchw_tilesize128x16x8_stage3_warpsize4x1x1_g1_ffma_aligna4_alignc4 Tactic: 0x40a12e3938221818 Time: 47.6435
[11/13/2025-13:36:48] [V] [TRT] Fast skip Tactic:0xcb8a43f748d8a338 which exceed time limit during pre-run
[11/13/2025-13:36:48] [V] [TRT] Tactic Name: sm80_xmma_fprop_implicit_gemm_indexed_f32f32_f32f32_f32_nchwkcrs_nchw_tilesize32x32x8_stage3_warpsize1x2x1_g1_ffma_aligna4_alignc4 Tactic: 0xcb8a43f748d8a338 Time: 32.1354
[11/13/2025-13:36:48] [V] [TRT] Tactic Name: sm80_xmma_fprop_wngd_f32f32_f32_f32_nchwkcrs_nchw_tilesize8x16x64x8_warpsize8x1x1_wngd2x2 Tactic: 0x0190806602534cfd Time: 9.06646
[11/13/2025-13:36:48] [V] [TRT] Fast skip Tactic:0xede36641840ce3d2 which exceed time limit during pre-run
[11/13/2025-13:36:48] [V] [TRT] Tactic Name: sm80_xmma_fprop_implicit_gemm_indexed_f32f32_f32f32_f32_nchwkcrs_nchw_tilesize128x64x8_stage2_warpsize1x4x1_g1_ffma_aligna4_alignc4_beta0_packed_stride Tactic: 0xede36641840ce3d2 Time: 20.3053
[11/13/2025-13:36:48] [V] [TRT] Fast skip Tactic:0x9d9fdb5fd9945f64 which exceed time limit during pre-run
[11/13/2025-13:36:48] [V] [TRT] Tactic Name: sm80_xmma_fprop_implicit_gemm_f32f32_f32f32_f32_nchwkcrs_nchw_tilesize128x16x8_stage3_warpsize4x1x1_g1_ffma_aligna4_alignc4 Tactic: 0x9d9fdb5fd9945f64 Time: 29.269
[11/13/2025-13:36:48] [V] [TRT] Tactic Name: sm80_xmma_fprop_implicit_gemm_f32f32_f32f32_f32_nchwkcrs_nchw_tilesize256x128x8_stage3_warpsize4x2x1_g1_ffma_aligna4_alignc4 Tactic: 0xbb8c3889c7eacd30 Time: 13.1919
[11/13/2025-13:36:49] [V] [TRT] Tactic Name: sm80_xmma_fprop_implicit_gemm_f32f32_f32f32_f32_nchwkcrs_nchw_tilesize128x64x8_stage2_warpsize1x4x1_g1_ffma_t1r3s3_aligna4_alignc4_beta0_packed_stride Tactic: 0x7fc93550f5b9c127 Time: 15.4448
[11/13/2025-13:36:49] [V] [TRT] Tactic Name: ampere_scudnn_winograd_128x128_ldg1_ldg4_relu_tile148t_nt_v1 Tactic: 0x94119b4c514b211a Time: 9.38995
[11/13/2025-13:36:49] [V] [TRT] Fast skip Tactic:0xd828f024626fa982 which exceed time limit during pre-run
[11/13/2025-13:36:49] [V] [TRT] Tactic Name: sm80_xmma_fprop_implicit_gemm_indexed_f32f32_f32f32_f32_nchwkcrs_nchw_tilesize64x64x8_stage3_warpsize1x4x1_g1_ffma_aligna4_alignc4 Tactic: 0xd828f024626fa982 Time: 21.5313
[11/13/2025-13:36:49] [V] [TRT] Tactic Name: sm80_xmma_fprop_implicit_gemm_f32f32_f32f32_f32_nchwkcrs_nchw_tilesize128x64x8_stage2_warpsize4x1x1_g1_ffma_t1r3s3_aligna4_alignc4_beta0_packed_stride Tactic: 0xe640ceafd7d34ca9 Time: 16.1467
[11/13/2025-13:36:49] [V] [TRT] Fast skip Tactic:0xb0bf940d5e0f9f45 which exceed time limit during pre-run
[11/13/2025-13:36:49] [V] [TRT] Tactic Name: sm80_xmma_fprop_implicit_gemm_f32f32_f32f32_f32_nchwkcrs_nchw_tilesize32x32x8_stage3_warpsize1x2x1_g1_ffma_aligna4_alignc4 Tactic: 0xb0bf940d5e0f9f45 Time: 22.9874
[11/13/2025-13:36:49] [V] [TRT] Fast skip Tactic:0xa8609adc4e0ceb90 which exceed time limit during pre-run
[11/13/2025-13:36:49] [V] [TRT] Tactic Name: ampere_scudnn_128x32_relu_small_nn_v1 Tactic: 0xa8609adc4e0ceb90 Time: 18.8822
[11/13/2025-13:36:49] [V] [TRT] Tactic Name: sm80_xmma_fprop_implicit_gemm_f32f32_f32f32_f32_nchwkcrs_nchw_tilesize128x64x8_stage3_warpsize2x2x1_g1_ffma_aligna4_alignc4 Tactic: 0x12dbf7d94ee3696d Time: 16.0182
[11/13/2025-13:36:49] [V] [TRT] Tactic Name: sm80_xmma_fprop_wngd_f32f32_f32_f32_nchwkcrs_nchw_tilesize8x16x16x8_warpsize8x1x1_wngd2x2 Tactic: 0xe38e9dfd56c33779 Time: 12.2088
[11/13/2025-13:36:50] [V] [TRT] Tactic Name: ampere_scudnn_128x64_relu_medium_nn_v1 Tactic: 0xf64396b97c889179 Time: 17.3101
[11/13/2025-13:36:50] [V] [TRT] Conv_1 + Relu_2 (CaskConvolution[0x80000009]) profiling completed in 4.53684 seconds. Fastest Tactic: 0x0190806602534cfd Time: 9.06646
[11/13/2025-13:36:50] [V] [TRT] Skipping CaskFlattenConvolution: No valid tactics for Conv_1 + Relu_2
[11/13/2025-13:36:50] [V] [TRT] >>>>>>>>>>>>>>> Chose Runner Type: CaskConvolution Tactic: 0x0190806602534cfd
[11/13/2025-13:36:50] [V] [TRT] *************** Autotuning format combination: Float(10886400,1,60480,336) -> Float(8294400,1,46080,256) ***************
[11/13/2025-13:36:50] [V] [TRT] --------------- Timing Runner: Conv_1 + Relu_2 (CaskConvolution[0x80000009])
[11/13/2025-13:36:50] [V] [TRT] Tactic Name: sm80_xmma_fprop_implicit_gemm_f32f32_f32f32_f32_nhwckrsc_nhwc_tilesize64x64x8_stage3_warpsize1x4x1_g1_ffma_t1r3s3_aligna4_alignc4 Tactic: 0x94a7db94ba744c45 Time: 15.0373
[11/13/2025-13:36:50] [V] [TRT] Tactic Name: sm80_xmma_fprop_implicit_gemm_f32f32_f32f32_f32_nhwckrsc_nhwc_tilesize128x64x8_stage3_warpsize2x2x1_g1_ffma_t1r3s3_aligna4_alignc4 Tactic: 0xf48db81f02eca9ee Time: 13.6435
[11/13/2025-13:36:50] [V] [TRT] Tactic Name: sm80_xmma_fprop_implicit_gemm_f32f32_f32f32_f32_nhwckrsc_nhwc_tilesize64x256x8_stage3_warpsize1x4x1_g1_ffma_t1r3s3_aligna4_alignc4 Tactic: 0x3f0c846d6379bc98 Time: 12.7868
[11/13/2025-13:36:50] [V] [TRT] Tactic Name: sm80_xmma_fprop_implicit_gemm_indexed_f32f32_f32f32_f32_nhwckrsc_nhwc_tilesize32x32x8_stage3_warpsize1x2x1_g1_ffma_aligna4_alignc4 Tactic: 0x0a143be7a52f301a Time: 25.2362
[11/13/2025-13:36:50] [V] [TRT] Tactic Name: sm80_xmma_fprop_implicit_gemm_f32f32_f32f32_f32_nhwckrsc_nhwc_tilesize64x128x8_stage3_warpsize1x4x1_g1_ffma_t1r3s3_aligna4_alignc4 Tactic: 0xd15dd11d64344e83 Time: 13.4774
[11/13/2025-13:36:51] [V] [TRT] Tactic Name: sm80_xmma_fprop_implicit_gemm_f32f32_f32f32_f32_nhwckrsc_nhwc_tilesize128x64x8_stage3_warpsize2x2x1_g1_ffma_aligna4_alignc4 Tactic: 0x1da91d865428f237 Time: 13.5645
[11/13/2025-13:36:51] [V] [TRT] Tactic Name: sm80_xmma_fprop_implicit_gemm_f32f32_f32f32_f32_nhwckrsc_nhwc_tilesize128x16x8_stage3_warpsize4x1x1_g1_ffma_aligna4_alignc4 Tactic: 0x92ed3100c35fc43e Time: 24.1253
[11/13/2025-13:36:51] [V] [TRT] Tactic Name: sm80_xmma_fprop_implicit_gemm_indexed_f32f32_f32f32_f32_nhwckrsc_nhwc_tilesize128x32x8_stage3_warpsize2x2x1_g1_ffma_aligna4_alignc4 Tactic: 0xa6448a1e79f1ca6f Time: 18.8232
[11/13/2025-13:36:51] [V] [TRT] Tactic Name: sm80_xmma_fprop_implicit_gemm_f32f32_f32f32_f32_nhwckrsc_nhwc_tilesize256x64x8_stage3_warpsize2x2x1_g1_ffma_aligna4_alignc4 Tactic: 0x8014228ec08b4d49 Time: 12.7651
[11/13/2025-13:36:51] [V] [TRT] Tactic Name: sm80_xmma_fprop_implicit_gemm_f32f32_f32f32_f32_nhwckrsc_nhwc_tilesize64x64x8_stage3_warpsize1x4x1_g1_ffma_aligna4_alignc4 Tactic: 0x62835fce994f06dd Time: 14.9518
[11/13/2025-13:36:51] [V] [TRT] Fast skip Tactic:0x4fd3c46622e98342 which exceed time limit during pre-run
[11/13/2025-13:36:51] [V] [TRT] Tactic Name: sm80_xmma_fprop_implicit_gemm_indexed_f32f32_f32f32_f32_nhwckrsc_nhwc_tilesize128x16x8_stage3_warpsize4x1x1_g1_ffma_aligna4_alignc4 Tactic: 0x4fd3c46622e98342 Time: 29.038
[11/13/2025-13:36:52] [V] [TRT] Tactic Name: sm80_xmma_fprop_implicit_gemm_f32f32_f32f32_f32_nhwckrsc_nhwc_tilesize128x16x8_stage3_warpsize4x1x1_g1_ffma_t1r3s3_aligna4_alignc4 Tactic: 0x32059de4888dfdda Time: 23.8842
[11/13/2025-13:36:52] [V] [TRT] Tactic Name: sm80_xmma_fprop_implicit_gemm_indexed_f32f32_f32f32_f32_nhwckrsc_nhwc_tilesize64x64x8_stage3_warpsize1x4x1_g1_ffma_aligna4_alignc4 Tactic: 0x19b688348f983aa0 Time: 16.921
[11/13/2025-13:36:52] [V] [TRT] Tactic Name: sm80_xmma_fprop_implicit_gemm_f32f32_f32f32_f32_nhwckrsc_nhwc_tilesize32x32x8_stage3_warpsize1x2x1_g1_ffma_t1r3s3_aligna4_alignc4 Tactic: 0x5953bec563d26434 Time: 22.6901
[11/13/2025-13:36:52] [V] [TRT] Tactic Name: sm80_xmma_fprop_implicit_gemm_f32f32_f32f32_f32_nhwckrsc_nhwc_tilesize32x32x8_stage3_warpsize1x2x1_g1_ffma_aligna4_alignc4 Tactic: 0x7121ec1db3f80c67 Time: 22.7811
[11/13/2025-13:36:52] [V] [TRT] Conv_1 + Relu_2 (CaskConvolution[0x80000009]) profiling completed in 2.77023 seconds. Fastest Tactic: 0x8014228ec08b4d49 Time: 12.7651
[11/13/2025-13:36:52] [V] [TRT] Skipping CaskFlattenConvolution: No valid tactics for Conv_1 + Relu_2
[11/13/2025-13:36:52] [V] [TRT] >>>>>>>>>>>>>>> Chose Runner Type: CaskConvolution Tactic: 0x8014228ec08b4d49
[11/13/2025-13:36:52] [V] [TRT] *************** Autotuning format combination: Float(2721600,1:4,15120,84) -> Float(8294400,32400,180,1) ***************
[11/13/2025-13:36:52] [V] [TRT] --------------- Timing Runner: Conv_1 + Relu_2 (CaskConvolution[0x80000009])
[11/13/2025-13:36:52] [V] [TRT] Tactic Name: sm80_xmma_fprop_implicit_gemm_f32f32_tf32f32_f32_nhwckrsc_nchw_tilesize128x128x32_stage4_warpsize2x2x1_g1_tensor16x8x8_t1r3s3 Tactic: 0xd7390b594d1ce947 Time: 3.05488
[11/13/2025-13:36:52] [V] [TRT] Tactic Name: sm80_xmma_fprop_implicit_gemm_indexed_f32f32_tf32f32_f32_nhwckrsc_nchw_tilesize128x256x32_stage3_warpsize2x4x1_g1_tensor16x8x8 Tactic: 0xcd6c525a3239bae9 Time: 2.95842
[11/13/2025-13:36:52] [V] [TRT] Fast skip Tactic:0xd106f5c552452296 which exceed time limit during pre-run
[11/13/2025-13:36:52] [V] [TRT] Tactic Name: sm80_xmma_fprop_implicit_gemm_f32f32_tf32f32_f32_nhwckrsc_nchw_tilesize64x32x64_stage5_warpsize2x2x1_g1_tensor16x8x8_t1r3s3_alignc4 Tactic: 0xd106f5c552452296 Time: 8.628
[11/13/2025-13:36:53] [V] [TRT] Tactic Name: sm80_xmma_fprop_implicit_gemm_f32f32_tf32f32_f32_nhwckrsc_nchw_tilesize128x64x32_stage5_warpsize2x2x1_g1_tensor16x8x8_alignc4 Tactic: 0x294c501bad19317c Time: 4.46673
[11/13/2025-13:36:53] [V] [TRT] Tactic Name: sm80_xmma_fprop_implicit_gemm_f32f32_tf32f32_f32_nhwckrsc_nchw_tilesize128x64x64_stage3_warpsize2x2x1_g1_tensor16x8x8_t1r3s3_alignc4 Tactic: 0x14ce6e2746cfbad7 Time: 4.78846
[11/13/2025-13:36:53] [V] [TRT] Tactic Name: sm80_xmma_fprop_implicit_gemm_f32f32_tf32f32_f32_nhwckrsc_nchw_tilesize128x128x16_stage4_warpsize2x2x1_g1_tensor16x8x8_t1r3s3_alignc4 Tactic: 0x1323e48791e2f671 Time: 3.04571
[11/13/2025-13:36:53] [V] [TRT] Tactic Name: sm80_xmma_fprop_implicit_gemm_f32f32_tf32f32_f32_nhwckrsc_nchw_tilesize128x128x16_stage4_warpsize2x2x1_g1_tensor16x8x8_alignc4 Tactic: 0x9fd9fe001908ce2e Time: 3.12706
[11/13/2025-13:36:53] [V] [TRT] Tactic Name: sm80_xmma_fprop_implicit_gemm_f32f32_tf32f32_f32_nhwckrsc_nchw_tilesize128x128x32_stage4_warpsize2x2x1_g1_tensor16x8x8_t1r3s3_alignc4 Tactic: 0xc50ec1760635de6f Time: 3.03982
[11/13/2025-13:36:53] [V] [TRT] Fast skip Tactic:0xf5c5ffdea9383daa which exceed time limit during pre-run
[11/13/2025-13:36:53] [V] [TRT] Tactic Name: sm80_xmma_fprop_implicit_gemm_f32f32_tf32f32_f32_nhwckrsc_nchw_tilesize64x32x64_stage5_warpsize2x2x1_g1_tensor16x8x8_t1r3s3 Tactic: 0xf5c5ffdea9383daa Time: 8.67974
[11/13/2025-13:36:53] [V] [TRT] Tactic Name: sm80_xmma_fprop_implicit_gemm_f32f32_tf32f32_f32_nhwckrsc_nchw_tilesize64x64x64_stage4_warpsize2x2x1_g1_tensor16x8x8_t1r3s3 Tactic: 0xbfdf05725bf3ea6d Time: 5.86826
[11/13/2025-13:36:53] [V] [TRT] Tactic Name: sm80_xmma_fprop_implicit_gemm_f32f32_tf32f32_f32_nhwckrsc_nchw_tilesize128x64x32_stage5_warpsize2x2x1_g1_tensor16x8x8 Tactic: 0xa95e2a26416587cd Time: 4.31886
[11/13/2025-13:36:53] [V] [TRT] Tactic Name: sm80_xmma_fprop_implicit_gemm_f32f32_tf32f32_f32_nhwckrsc_nchw_tilesize256x128x32_stage3_warpsize4x2x1_g1_tensor16x8x8_t1r3s3 Tactic: 0x2f3dd4e092216107 Time: 2.89259
[11/13/2025-13:36:53] [V] [TRT] Tactic Name: sm80_xmma_fprop_implicit_gemm_indexed_f32f32_tf32f32_f32_nhwckrsc_nchw_tilesize128x128x16_stage4_warpsize2x2x1_g1_tensor16x8x8_alignc4 Tactic: 0xe8f7b6a5bab325f8 Time: 3.3122
[11/13/2025-13:36:53] [V] [TRT] Tactic Name: sm80_xmma_fprop_implicit_gemm_indexed_f32f32_tf32f32_f32_nhwckrsc_nchw_tilesize128x256x32_stage3_warpsize2x4x1_g1_tensor16x8x8_alignc4 Tactic: 0xbf7080aca6804022 Time: 2.93987
[11/13/2025-13:36:53] [V] [TRT] Tactic Name: sm80_xmma_fprop_implicit_gemm_f32f32_tf32f32_f32_nhwckrsc_nchw_tilesize64x128x32_stage5_warpsize2x2x1_g1_tensor16x8x8_t1r3s3 Tactic: 0xec566784128c4eda Time: 4.37866
[11/13/2025-13:36:53] [V] [TRT] Tactic Name: sm80_xmma_fprop_implicit_gemm_indexed_f32f32_tf32f32_f32_nhwckrsc_nchw_tilesize128x128x16_stage4_warpsize2x2x1_g1_tensor16x8x8 Tactic: 0xe0a307ffe0ffb6a5 Time: 3.3616
[11/13/2025-13:36:53] [V] [TRT] Tactic Name: sm80_xmma_fprop_implicit_gemm_indexed_f32f32_tf32f32_f32_nhwckrsc_nchw_tilesize256x64x32_stage3_warpsize4x2x1_g1_tensor16x8x8 Tactic: 0x7449ed93fb7feabf Time: 4.01471
[11/13/2025-13:36:53] [V] [TRT] Tactic Name: sm80_xmma_fprop_implicit_gemm_f32f32_tf32f32_f32_nhwckrsc_nchw_tilesize128x128x32_stage4_warpsize2x2x1_g1_tensor16x8x8 Tactic: 0xa0f5a3abd9b9c82a Time: 3.0512
[11/13/2025-13:36:53] [V] [TRT] Tactic Name: sm80_xmma_fprop_implicit_gemm_f32f32_tf32f32_f32_nhwckrsc_nchw_tilesize256x64x32_stage3_warpsize4x2x1_g1_tensor16x8x8 Tactic: 0x009385d9017d87ea Time: 3.76206
[11/13/2025-13:36:53] [V] [TRT] Tactic Name: sm80_xmma_fprop_implicit_gemm_f32f32_tf32f32_f32_nhwckrsc_nchw_tilesize64x128x32_stage5_warpsize2x2x1_g1_tensor16x8x8 Tactic: 0xabbf7eb3b5b99502 Time: 4.25371
[11/13/2025-13:36:53] [V] [TRT] Tactic Name: sm80_xmma_fprop_implicit_gemm_f32f32_tf32f32_f32_nhwckrsc_nchw_tilesize128x256x32_stage3_warpsize2x4x1_g1_tensor16x8x8_t1r3s3 Tactic: 0x6f57319253e043c7 Time: 2.83055
[11/13/2025-13:36:53] [V] [TRT] Tactic Name: sm80_xmma_fprop_implicit_gemm_f32f32_tf32f32_f32_nhwckrsc_nchw_tilesize128x64x32_stage5_warpsize2x2x1_g1_tensor16x8x8_t1r3s3_alignc4 Tactic: 0x2bf0858f240ff918 Time: 4.37298
[11/13/2025-13:36:53] [V] [TRT] Tactic Name: sm80_xmma_fprop_implicit_gemm_f32f32_tf32f32_f32_nhwckrsc_nchw_tilesize64x128x32_stage5_warpsize2x2x1_g1_tensor16x8x8_alignc4 Tactic: 0x8a196054417f1c8a Time: 4.39847
[11/13/2025-13:36:54] [V] [TRT] Tactic Name: sm80_xmma_fprop_implicit_gemm_indexed_f32f32_tf32f32_f32_nhwckrsc_nchw_tilesize128x64x32_stage5_warpsize2x2x1_g1_tensor16x8x8 Tactic: 0xdd84426cbb67ea98 Time: 4.73105
[11/13/2025-13:36:54] [V] [TRT] Tactic Name: sm80_xmma_fprop_implicit_gemm_f32f32_tf32f32_f32_nhwckrsc_nchw_tilesize128x64x32_stage5_warpsize2x2x1_g1_tensor16x8x8_t1r3s3 Tactic: 0x42b6ff75b94b8cbd Time: 4.38558
[11/13/2025-13:36:54] [V] [TRT] Tactic Name: sm80_xmma_fprop_implicit_gemm_f32f32_tf32f32_f32_nhwckrsc_nchw_tilesize256x128x32_stage3_warpsize4x2x1_g1_tensor16x8x8 Tactic: 0x62d0fae781700403 Time: 2.91119
[11/13/2025-13:36:54] [V] [TRT] Fast skip Tactic:0x7c012183b88ca724 which exceed time limit during pre-run
[11/13/2025-13:36:54] [V] [TRT] Tactic Name: sm80_xmma_fprop_implicit_gemm_f32f32_tf32f32_f32_nhwckrsc_nchw_tilesize64x64x64_stage4_warpsize2x2x1_g1_tensor16x8x8 Tactic: 0x7c012183b88ca724 Time: 5.98125
[11/13/2025-13:36:54] [V] [TRT] Tactic Name: sm80_xmma_fprop_implicit_gemm_f32f32_tf32f32_f32_nhwckrsc_nchw_tilesize128x128x32_stage4_warpsize2x2x1_g1_tensor16x8x8_alignc4 Tactic: 0x018af1a619a2581c Time: 3.09971
[11/13/2025-13:36:54] [V] [TRT] Tactic Name: sm80_xmma_fprop_implicit_gemm_f32f32_tf32f32_f32_nhwckrsc_nchw_tilesize64x128x32_stage5_warpsize2x2x1_g1_tensor16x8x8_t1r3s3_alignc4 Tactic: 0x324c63b421c25d95 Time: 4.38149
[11/13/2025-13:36:54] [V] [TRT] Fast skip Tactic:0xc5dec88c13d30802 which exceed time limit during pre-run
[11/13/2025-13:36:54] [V] [TRT] Tactic Name: sm80_xmma_fprop_implicit_gemm_indexed_f32f32_tf32f32_f32_nhwckrsc_nchw_tilesize64x64x64_stage4_warpsize2x2x1_g1_tensor16x8x8 Tactic: 0xc5dec88c13d30802 Time: 6.67066
[11/13/2025-13:36:54] [V] [TRT] Tactic Name: sm80_xmma_fprop_implicit_gemm_indexed_f32f32_tf32f32_f32_nhwckrsc_nchw_tilesize128x64x64_stage3_warpsize2x2x1_g1_tensor16x8x8_alignc4 Tactic: 0xf00aea93dd9c2661 Time: 5.0489
[11/13/2025-13:36:54] [V] [TRT] Fast skip Tactic:0x2a70e740f46257d6 which exceed time limit during pre-run
[11/13/2025-13:36:54] [V] [TRT] Tactic Name: sm80_xmma_fprop_implicit_gemm_indexed_f32f32_tf32f32_f32_nhwckrsc_nchw_tilesize64x32x64_stage5_warpsize2x2x1_g1_tensor16x8x8 Tactic: 0x2a70e740f46257d6 Time: 10.3617
[11/13/2025-13:36:54] [V] [TRT] Tactic Name: sm80_xmma_fprop_implicit_gemm_f32f32_tf32f32_f32_nhwckrsc_nchw_tilesize128x256x32_stage3_warpsize2x4x1_g1_tensor16x8x8_alignc4 Tactic: 0xc85ec809053babf4 Time: 2.90387
[11/13/2025-13:36:54] [V] [TRT] Tactic Name: sm80_xmma_fprop_implicit_gemm_indexed_f32f32_tf32f32_f32_nhwckrsc_nchw_tilesize64x128x32_stage5_warpsize2x2x1_g1_tensor16x8x8 Tactic: 0xdf6516f94fbbf857 Time: 4.5541
[11/13/2025-13:36:54] [V] [TRT] Tactic Name: sm80_xmma_fprop_implicit_gemm_f32f32_tf32f32_f32_nhwckrsc_nchw_tilesize128x128x16_stage4_warpsize2x2x1_g1_tensor16x8x8_t1r3s3 Tactic: 0x9787b83bedcff6a2 Time: 3.22908
[11/13/2025-13:36:54] [V] [TRT] Fast skip Tactic:0x0184e974dcc2b593 which exceed time limit during pre-run
[11/13/2025-13:36:54] [V] [TRT] Tactic Name: sm80_xmma_fprop_implicit_gemm_f32f32_tf32f32_f32_nhwckrsc_nchw_tilesize64x64x64_stage4_warpsize2x2x1_g1_tensor16x8x8_t1r3s3_alignc4 Tactic: 0x0184e974dcc2b593 Time: 5.84954
[11/13/2025-13:36:54] [V] [TRT] Fast skip Tactic:0x06ac89b47db4fceb which exceed time limit during pre-run
[11/13/2025-13:36:54] [V] [TRT] Tactic Name: sm80_xmma_fprop_implicit_gemm_indexed_f32f32_tf32f32_f32_nhwckrsc_nchw_tilesize64x32x64_stage5_warpsize2x2x1_g1_tensor16x8x8_alignc4 Tactic: 0x06ac89b47db4fceb Time: 10.1244
[11/13/2025-13:36:54] [V] [TRT] Tactic Name: sm80_xmma_fprop_implicit_gemm_f32f32_tf32f32_f32_nhwckrsc_nchw_tilesize128x128x16_stage4_warpsize2x2x1_g1_tensor16x8x8 Tactic: 0x3104d85fecdd547c Time: 3.13641
[11/13/2025-13:36:54] [V] [TRT] Tactic Name: sm80_xmma_fprop_implicit_gemm_indexed_f32f32_tf32f32_f32_nhwckrsc_nchw_tilesize64x128x32_stage5_warpsize2x2x1_g1_tensor16x8x8_alignc4 Tactic: 0xe25738550dba0da6 Time: 4.59419
[11/13/2025-13:36:54] [V] [TRT] Tactic Name: sm80_xmma_fprop_implicit_gemm_f32f32_tf32f32_f32_nhwckrsc_nchw_tilesize128x256x32_stage3_warpsize2x4x1_g1_tensor16x8x8_t1r3s3_alignc4 Tactic: 0x58d98689a7f663f8 Time: 2.82107
[11/13/2025-13:36:54] [V] [TRT] Fast skip Tactic:0x681a3b4e03528583 which exceed time limit during pre-run
[11/13/2025-13:36:54] [V] [TRT] Tactic Name: sm80_xmma_fprop_implicit_gemm_f32f32_tf32f32_f32_nhwckrsc_nchw_tilesize64x32x64_stage5_warpsize2x2x1_g1_tensor16x8x8_alignc4 Tactic: 0x681a3b4e03528583 Time: 9.04042
[11/13/2025-13:36:54] [V] [TRT] Tactic Name: sm80_xmma_fprop_implicit_gemm_f32f32_tf32f32_f32_nhwckrsc_nchw_tilesize256x64x32_stage3_warpsize4x2x1_g1_tensor16x8x8_alignc4 Tactic: 0xdb50068f2f28400e Time: 3.77788
[11/13/2025-13:36:54] [V] [TRT] Fast skip Tactic:0x93af0e4f5f3df8f0 which exceed time limit during pre-run
[11/13/2025-13:36:54] [V] [TRT] Tactic Name: sm80_xmma_fprop_implicit_gemm_f32f32_tf32f32_f32_nhwckrsc_nchw_tilesize64x32x64_stage5_warpsize2x2x1_g1_tensor16x8x8 Tactic: 0x93af0e4f5f3df8f0 Time: 8.83642
[11/13/2025-13:36:54] [V] [TRT] Tactic Name: sm80_xmma_fprop_implicit_gemm_f32f32_tf32f32_f32_nhwckrsc_nchw_tilesize128x64x64_stage3_warpsize2x2x1_g1_tensor16x8x8 Tactic: 0x0eef7d6cf0568181 Time: 4.8661
[11/13/2025-13:36:55] [V] [TRT] Tactic Name: sm80_xmma_fprop_implicit_gemm_f32f32_tf32f32_f32_nhwckrsc_nchw_tilesize256x128x32_stage3_warpsize4x2x1_g1_tensor16x8x8_t1r3s3_alignc4 Tactic: 0x5949792953380d23 Time: 2.80633
[11/13/2025-13:36:55] [V] [TRT] Tactic Name: sm80_xmma_fprop_implicit_gemm_f32f32_tf32f32_f32_nhwckrsc_nchw_tilesize256x64x32_stage3_warpsize4x2x1_g1_tensor16x8x8_t1r3s3 Tactic: 0x91b480f174a2dfab Time: 3.80572
[11/13/2025-13:36:55] [V] [TRT] Tactic Name: sm80_xmma_fprop_implicit_gemm_f32f32_tf32f32_f32_nhwckrsc_nchw_tilesize128x256x32_stage3_warpsize2x4x1_g1_tensor16x8x8 Tactic: 0x1ccb8dfa3e1b5830 Time: 2.86502
[11/13/2025-13:36:55] [V] [TRT] Fast skip Tactic:0x9746567cb96a1ed8 which exceed time limit during pre-run
[11/13/2025-13:36:55] [V] [TRT] Tactic Name: sm80_xmma_fprop_implicit_gemm_indexed_f32f32_tf32f32_f32_nhwckrsc_nchw_tilesize64x64x64_stage4_warpsize2x2x1_g1_tensor16x8x8_alignc4 Tactic: 0x9746567cb96a1ed8 Time: 6.58938
[11/13/2025-13:36:55] [V] [TRT] Tactic Name: sm80_xmma_fprop_implicit_gemm_f32f32_tf32f32_f32_nhwckrsc_nchw_tilesize256x64x32_stage3_warpsize4x2x1_g1_tensor16x8x8_t1r3s3_alignc4 Tactic: 0xe827e2035205730f Time: 3.75857
[11/13/2025-13:36:55] [V] [TRT] Fast skip Tactic:0xf9f0e486c78c67b0 which exceed time limit during pre-run
[11/13/2025-13:36:55] [V] [TRT] Tactic Name: sm80_xmma_fprop_implicit_gemm_f32f32_tf32f32_f32_nhwckrsc_nchw_tilesize64x64x64_stage4_warpsize2x2x1_g1_tensor16x8x8_alignc4 Tactic: 0xf9f0e486c78c67b0 Time: 6.15293
[11/13/2025-13:36:55] [V] [TRT] Conv_1 + Relu_2 (CaskConvolution[0x80000009]) profiling completed in 2.38603 seconds. Fastest Tactic: 0x5949792953380d23 Time: 2.80633
[11/13/2025-13:36:55] [V] [TRT] Skipping CaskFlattenConvolution: No valid tactics for Conv_1 + Relu_2
[11/13/2025-13:36:55] [V] [TRT] >>>>>>>>>>>>>>> Chose Runner Type: CaskConvolution Tactic: 0x5949792953380d23
[11/13/2025-13:36:55] [V] [TRT] *************** Autotuning format combination: Float(2721600,1:4,15120,84) -> Float(2073600,1:4,11520,64) ***************
[11/13/2025-13:36:55] [V] [TRT] --------------- Timing Runner: Conv_1 + Relu_2 (CaskConvolution[0x80000009])
[11/13/2025-13:36:55] [V] [TRT] Tactic Name: ampere_scudnn_128x32_sliced1x4_ldg4_relu_exp_small_nhwc_tn_v1 Tactic: 0x3e2b881168d9689d Time: 18.0134
[11/13/2025-13:36:55] [V] [TRT] Tactic Name: ampere_scudnn_128x128_ldg4_relu_exp_medium_nhwc_tn_v1 Tactic: 0x7bc32c782b800c48 Time: 14.602
[11/13/2025-13:36:55] [V] [TRT] Tactic Name: ampere_scudnn_128x128_ldg4_relu_exp_small_nhwc_tn_v1 Tactic: 0xf90060ce8193b811 Time: 14.5901
[11/13/2025-13:36:55] [V] [TRT] Tactic Name: ampere_scudnn_128x64_sliced1x2_ldg4_relu_exp_large_nhwc_tn_v1 Tactic: 0xbdfdef6b84f7ccc9 Time: 16.59
[11/13/2025-13:36:55] [V] [TRT] Tactic Name: sm80_xmma_fprop_implicit_gemm_f32f32_tf32f32_f32_nhwckrsc_nhwc_tilesize64x128x32_stage5_warpsize2x2x1_g1_tensor16x8x8 Tactic: 0x65f71607d20d5438 Time: 4.23446
[11/13/2025-13:36:56] [V] [TRT] Tactic Name: sm80_xmma_fprop_implicit_gemm_f32f32_tf32f32_f32_nhwckrsc_nhwc_tilesize128x128x16_stage4_warpsize2x2x1_g1_tensor16x8x8 Tactic: 0xb443c221fcb1565b Time: 3.13011
[11/13/2025-13:36:56] [V] [TRT] Tactic Name: sm80_xmma_fprop_implicit_gemm_f32f32_tf32f32_f32_nhwckrsc_nhwc_tilesize128x128x32_stage4_warpsize2x2x1_g1_tensor16x8x8 Tactic: 0x25b2b9d5c9d5ca0d Time: 3.00223
[11/13/2025-13:36:56] [V] [TRT] Tactic Name: sm80_xmma_fprop_implicit_gemm_f32f32_tf32f32_f32_nhwckrsc_nhwc_tilesize256x64x32_stage3_warpsize4x2x1_g1_tensor16x8x8_t1r3s3 Tactic: 0xa9a06d0633580c0c Time: 3.70158
[11/13/2025-13:36:56] [V] [TRT] Tactic Name: sm80_xmma_fprop_implicit_gemm_f32f32_tf32f32_f32_nhwckrsc_nhwc_tilesize64x64x64_stage4_warpsize2x2x1_g1_tensor16x8x8_t1r3s3 Tactic: 0x2d80d2b384ab13f1 Time: 5.74582
[11/13/2025-13:36:56] [V] [TRT] Fast skip Tactic:0xd7f5d575d49a4bc7 which exceed time limit during pre-run
[11/13/2025-13:36:56] [V] [TRT] Tactic Name: sm80_xmma_fprop_implicit_gemm_indexed_f32f32_tf32f32_f32_nhwckrsc_nhwc_tilesize64x32x64_stage5_warpsize2x2x1_g1_tensor16x8x8 Tactic: 0xd7f5d575d49a4bc7 Time: 10.1228
[11/13/2025-13:36:56] [V] [TRT] Tactic Name: sm80_xmma_fprop_implicit_gemm_indexed_f32f32_tf32f32_f32_nhwckrsc_nhwc_tilesize128x256x32_stage3_warpsize2x4x1_g1_tensor16x8x8 Tactic: 0x482b48242255b8ce Time: 2.87808
[11/13/2025-13:36:56] [V] [TRT] Tactic Name: sm80_xmma_fprop_implicit_gemm_indexed_f32f32_tf32f32_f32_nhwckrsc_nhwc_tilesize256x64x32_stage3_warpsize4x2x1_g1_tensor16x8x8 Tactic: 0xba0185279ccb2b85 Time: 4.05056
[11/13/2025-13:36:56] [V] [TRT] Tactic Name: sm80_xmma_fprop_implicit_gemm_f32f32_tf32f32_f32_nhwckrsc_nhwc_tilesize256x128x32_stage3_warpsize4x2x1_g1_tensor16x8x8_t1r3s3 Tactic: 0x21246c8544eff903 Time: 2.75518
[11/13/2025-13:36:56] [V] [TRT] Fast skip Tactic:0x385bfab9332b1413 which exceed time limit during pre-run
[11/13/2025-13:36:56] [V] [TRT] Tactic Name: sm80_xmma_fprop_implicit_gemm_indexed_f32f32_tf32f32_f32_nhwckrsc_nhwc_tilesize64x64x64_stage4_warpsize2x2x1_g1_tensor16x8x8 Tactic: 0x385bfab9332b1413 Time: 6.62947
[11/13/2025-13:36:56] [V] [TRT] Tactic Name: sm80_xmma_fprop_implicit_gemm_indexed_f32f32_tf32f32_f32_nhwckrsc_nhwc_tilesize128x128x16_stage4_warpsize2x2x1_g1_tensor16x8x8 Tactic: 0x65e41d81f093b482 Time: 3.28659
[11/13/2025-13:36:56] [V] [TRT] Tactic Name: sm80_xmma_fprop_implicit_gemm_f32f32_tf32f32_f32_nhwckrsc_nhwc_tilesize128x64x32_stage5_warpsize2x2x1_g1_tensor16x8x8_t1r3s3 Tactic: 0x7aa21282feb15f1a Time: 4.21832
[11/13/2025-13:36:56] [V] [TRT] Tactic Name: sm80_xmma_fprop_implicit_gemm_f32f32_tf32f32_f32_nhwckrsc_nhwc_tilesize128x64x64_stage3_warpsize2x2x1_g1_tensor16x8x8 Tactic: 0xc0a715d897e240bb Time: 4.84708
[11/13/2025-13:36:56] [V] [TRT] Tactic Name: sm80_xmma_fprop_implicit_gemm_f32f32_tf32f32_f32_nhwckrsc_nhwc_tilesize128x128x16_stage4_warpsize2x2x1_g1_tensor16x8x8_t1r3s3 Tactic: 0x999e005e3b016ea6 Time: 3.02903
[11/13/2025-13:36:56] [V] [TRT] Tactic Name: sm80_xmma_fprop_implicit_gemm_f32f32_tf32f32_f32_nhwckrsc_nhwc_tilesize128x256x32_stage3_warpsize2x4x1_g1_tensor16x8x8_t1r3s3 Tactic: 0x614e89f7852edbc3 Time: 2.76504
[11/13/2025-13:36:56] [V] [TRT] Tactic Name: sm80_xmma_fprop_implicit_gemm_f32f32_tf32f32_f32_nhwckrsc_nhwc_tilesize128x128x32_stage4_warpsize2x2x1_g1_tensor16x8x8_t1r3s3 Tactic: 0xd920b33c9bd27143 Time: 2.96124
[11/13/2025-13:36:56] [V] [TRT] Tactic Name: sm80_xmma_fprop_implicit_gemm_f32f32_tf32f32_f32_nhwckrsc_nhwc_tilesize128x64x32_stage5_warpsize2x2x1_g1_tensor16x8x8 Tactic: 0x6716429226d146f7 Time: 4.31696
[11/13/2025-13:36:56] [V] [TRT] Fast skip Tactic:0x679a281f7660c436 which exceed time limit during pre-run
[11/13/2025-13:36:56] [V] [TRT] Tactic Name: sm80_xmma_fprop_implicit_gemm_f32f32_tf32f32_f32_nhwckrsc_nhwc_tilesize64x32x64_stage5_warpsize2x2x1_g1_tensor16x8x8_t1r3s3 Tactic: 0x679a281f7660c436 Time: 8.79411
[11/13/2025-13:36:56] [V] [TRT] Tactic Name: sm80_xmma_fprop_implicit_gemm_f32f32_tf32f32_f32_nhwckrsc_nhwc_tilesize128x64x64_stage3_warpsize2x2x1_g1_tensor16x8x8_t1r3s3 Tactic: 0xeb65d4c1e8fa2294 Time: 4.64485
[11/13/2025-13:36:56] [V] [TRT] Tactic Name: sm80_xmma_fprop_implicit_gemm_indexed_f32f32_tf32f32_f32_nhwckrsc_nhwc_tilesize128x128x32_stage4_warpsize2x2x1_g1_tensor16x8x8 Tactic: 0xf4156675c5f728d4 Time: 4.69024
[11/13/2025-13:36:56] [V] [TRT] Tactic Name: sm80_xmma_fprop_implicit_gemm_indexed_f32f32_tf32f32_f32_nhwckrsc_nhwc_tilesize64x128x32_stage5_warpsize2x2x1_g1_tensor16x8x8 Tactic: 0x112d7e4d280f396d Time: 4.47929
[11/13/2025-13:36:57] [V] [TRT] Fast skip Tactic:0x6e2a3c7a7fc5e4e1 which exceed time limit during pre-run
[11/13/2025-13:36:57] [V] [TRT] Tactic Name: sm80_xmma_fprop_implicit_gemm_f32f32_tf32f32_f32_nhwckrsc_nhwc_tilesize64x32x64_stage5_warpsize2x2x1_g1_tensor16x8x8 Tactic: 0x6e2a3c7a7fc5e4e1 Time: 8.8735
[11/13/2025-13:36:57] [V] [TRT] Tactic Name: sm80_xmma_fprop_implicit_gemm_indexed_f32f32_tf32f32_f32_nhwckrsc_nhwc_tilesize128x64x32_stage5_warpsize2x2x1_g1_tensor16x8x8 Tactic: 0x13cc2ad8dcd32ba2 Time: 4.81034
[11/13/2025-13:36:57] [V] [TRT] Tactic Name: sm80_xmma_fprop_implicit_gemm_f32f32_tf32f32_f32_nhwckrsc_nhwc_tilesize256x128x32_stage3_warpsize4x2x1_g1_tensor16x8x8 Tactic: 0xe797e099911c0624 Time: 2.86912
[11/13/2025-13:36:57] [V] [TRT] Tactic Name: sm80_xmma_fprop_implicit_gemm_indexed_f32f32_tf32f32_f32_nhwckrsc_nhwc_tilesize256x128x32_stage3_warpsize4x2x1_g1_tensor16x8x8 Tactic: 0x36303f399d3ee4fd Time: 3.4517
[11/13/2025-13:36:57] [V] [TRT] Tactic Name: sm80_xmma_fprop_implicit_gemm_f32f32_tf32f32_f32_nhwckrsc_nhwc_tilesize64x128x32_stage5_warpsize2x2x1_g1_tensor16x8x8_t1r3s3 Tactic: 0xd4428a7355769d7d Time: 4.12463
[11/13/2025-13:36:57] [V] [TRT] Tactic Name: sm80_xmma_fprop_implicit_gemm_indexed_f32f32_tf32f32_f32_nhwckrsc_nhwc_tilesize128x64x64_stage3_warpsize2x2x1_g1_tensor16x8x8 Tactic: 0xb47d7d926de02dee Time: 5.10186
[11/13/2025-13:36:57] [V] [TRT] Fast skip Tactic:0x818413b69874bb35 which exceed time limit during pre-run
[11/13/2025-13:36:57] [V] [TRT] Tactic Name: sm80_xmma_fprop_implicit_gemm_f32f32_tf32f32_f32_nhwckrsc_nhwc_tilesize64x64x64_stage4_warpsize2x2x1_g1_tensor16x8x8 Tactic: 0x818413b69874bb35 Time: 5.89917
[11/13/2025-13:36:57] [V] [TRT] Tactic Name: sm80_xmma_fprop_implicit_gemm_f32f32_tf32f32_f32_nhwckrsc_nhwc_tilesize128x256x32_stage3_warpsize2x4x1_g1_tensor16x8x8 Tactic: 0x998c97842e775a17 Time: 2.86388
[11/13/2025-13:36:57] [V] [TRT] Tactic Name: sm80_xmma_fprop_implicit_gemm_f32f32_tf32f32_f32_nhwckrsc_nhwc_tilesize256x64x32_stage3_warpsize4x2x1_g1_tensor16x8x8 Tactic: 0xcedbed6d66c946d0 Time: 3.72753
[11/13/2025-13:36:57] [V] [TRT] Conv_1 + Relu_2 (CaskConvolution[0x80000009]) profiling completed in 2.17738 seconds. Fastest Tactic: 0x21246c8544eff903 Time: 2.75518
[11/13/2025-13:36:57] [V] [TRT] Skipping CaskFlattenConvolution: No valid tactics for Conv_1 + Relu_2
[11/13/2025-13:36:57] [V] [TRT] >>>>>>>>>>>>>>> Chose Runner Type: CaskConvolution Tactic: 0x21246c8544eff903
[11/13/2025-13:36:57] [V] [TRT] *************** Autotuning format combination: Half(10886400,32400,180,1) -> Half(8294400,32400,180,1) ***************
[11/13/2025-13:36:57] [V] [TRT] Skipping CaskConvolution: No valid tactics for Conv_1 + Relu_2
[11/13/2025-13:36:57] [V] [TRT] Skipping CaskFlattenConvolution: No valid tactics for Conv_1 + Relu_2
[11/13/2025-13:36:57] [V] [TRT] *************** Autotuning format combination: Half(5443200,1:2,30240,168) -> Half(4147200,1:2,23040,128) ***************
[11/13/2025-13:36:57] [V] [TRT] Skipping CaskConvolution: No valid tactics for Conv_1 + Relu_2
[11/13/2025-13:36:57] [V] [TRT] Skipping CaskFlattenConvolution: No valid tactics for Conv_1 + Relu_2
[11/13/2025-13:36:57] [V] [TRT] *************** Autotuning format combination: Half(2721600,1:4,15120,84) -> Half(2073600,1:4,11520,64) ***************
[11/13/2025-13:36:57] [V] [TRT] Skipping CaskConvolution: No valid tactics for Conv_1 + Relu_2
[11/13/2025-13:36:57] [V] [TRT] Skipping CaskFlattenConvolution: No valid tactics for Conv_1 + Relu_2
[11/13/2025-13:36:57] [V] [TRT] *************** Autotuning format combination: Half(1360800,1:8,7560,42) -> Float(8294400,32400,180,1) ***************
[11/13/2025-13:36:57] [V] [TRT] Skipping CaskConvolution: No valid tactics for Conv_1 + Relu_2
[11/13/2025-13:36:57] [V] [TRT] Skipping CaskFlattenConvolution: No valid tactics for Conv_1 + Relu_2
[11/13/2025-13:36:57] [V] [TRT] *************** Autotuning format combination: Half(1360800,1:8,7560,42) -> Half(1036800,1:8,5760,32) ***************
[11/13/2025-13:36:57] [V] [TRT] --------------- Timing Runner: Conv_1 + Relu_2 (CaskConvolution[0x80000009])
[11/13/2025-13:36:57] [V] [TRT] Tactic Name: sm80_xmma_fprop_implicit_gemm_f16f16_f16f16_f16_nhwckrsc_nhwc_tilesize128x128x32_stage4_warpsize2x2x1_g1_tensor16x8x16_t1r3s3_aACCESS Tactic: 0x245530c34bd6090f Time: 1.52066
[11/13/2025-13:36:57] [V] [TRT] Tactic Name: sm80_xmma_fprop_implicit_gemm_f16f16_f16f16_f16_nhwckrsc_nhwc_tilesize256x64x32_stage3_warpsize4x1x1_g1_tensor16x8x16_t1r3s3_aACCESS Tactic: 0x0866ddee325d07a6 Time: 2.11197
[11/13/2025-13:36:57] [V] [TRT] Fast skip Tactic:0xa033e20ae9f412b2 which exceed time limit during pre-run
[11/13/2025-13:36:57] [V] [TRT] Tactic Name: sm80_xmma_fprop_implicit_gemm_f16f16_f16f16_f16_nhwckrsc_nhwc_tilesize64x32x64_stage5_warpsize2x2x1_g1_tensor16x8x16_t1r3s3 Tactic: 0xa033e20ae9f412b2 Time: 4.0439
[11/13/2025-13:36:57] [V] [TRT] Fast skip Tactic:0x5820b3dda403c4d0 which exceed time limit during pre-run
[11/13/2025-13:36:57] [V] [TRT] Tactic Name: sm80_xmma_fprop_implicit_gemm_f16f16_f16f16_f16_nhwckrsc_nhwc_tilesize64x32x64_stage5_warpsize2x2x1_g1_tensor16x8x16 Tactic: 0x5820b3dda403c4d0 Time: 4.05082
[11/13/2025-13:36:57] [V] [TRT] Fast skip Tactic:0x834e11ecd4ab9454 which exceed time limit during pre-run
[11/13/2025-13:36:57] [V] [TRT] Tactic Name: sm80_xmma_fprop_implicit_gemm_f16f16_f16f16_f16_nhwckrsc_nhwc_tilesize128x32x32_stage4_warpsize4x1x1_g1_tensor16x8x16 Tactic: 0x834e11ecd4ab9454 Time: 4.12112
[11/13/2025-13:36:57] [V] [TRT] Tactic Name: sm80_xmma_fprop_implicit_gemm_f16f16_f16f16_f16_nhwckrsc_nhwc_tilesize128x64x32_stage5_warpsize2x2x1_g1_tensor16x8x16 Tactic: 0xbd08239a9317f2fd Time: 2.47603
[11/13/2025-13:36:57] [V] [TRT] Tactic Name: sm80_xmma_fprop_implicit_gemm_f16f16_f16f16_f16_nhwckrsc_nhwc_tilesize128x128x32_stage4_warpsize2x2x1_g1_tensor16x8x16_t1r3s3 Tactic: 0x60c3421152ef8e10 Time: 1.66725
[11/13/2025-13:36:57] [V] [TRT] Tactic Name: sm80_xmma_fprop_implicit_gemm_f16f16_f16f16_f16_nhwckrsc_nhwc_tilesize128x128x32_stage4_warpsize2x2x1_g1_tensor16x8x16 Tactic: 0xdfa020ef435ef810 Time: 1.66739
[11/13/2025-13:36:57] [V] [TRT] Tactic Name: sm80_xmma_fprop_implicit_gemm_f16f16_f16f16_f16_nhwckrsc_nhwc_tilesize128x128x64_stage3_warpsize2x2x1_g1_tensor16x8x16 Tactic: 0x57c9a5ff682354a6 Time: 1.70848
[11/13/2025-13:36:57] [V] [TRT] Tactic Name: sm80_xmma_fprop_implicit_gemm_f16f16_f16f16_f16_nhwckrsc_nhwc_tilesize128x256x32_stage3_warpsize2x4x1_g1_tensor16x8x16_t1r3s3 Tactic: 0xa9177bbe4e767df8 Time: 1.49826
[11/13/2025-13:36:57] [V] [TRT] Tactic Name: sm80_xmma_fprop_implicit_gemm_f16f16_f16f16_f16_nhwckrsc_nhwc_tilesize128x256x32_stage3_warpsize2x4x1_g1_tensor16x8x16 Tactic: 0xa1a20ea714d420f4 Time: 1.49975
[11/13/2025-13:36:57] [V] [TRT] Tactic Name: sm80_xmma_fprop_implicit_gemm_f16f16_f16f16_f16_nhwckrsc_nhwc_tilesize256x128x64_stage3_warpsize4x2x1_g1_tensor16x8x16_t1r3s3 Tactic: 0xd2fca0486ca97266 Time: 1.63347
[11/13/2025-13:36:57] [V] [TRT] Tactic Name: sm80_xmma_fprop_implicit_gemm_f16f16_f16f16_f16_nhwckrsc_nhwc_tilesize256x128x64_stage3_warpsize4x2x1_g1_tensor16x8x16 Tactic: 0x5a55274960724ba8 Time: 1.62478
[11/13/2025-13:36:57] [V] [TRT] Tactic Name: sm80_xmma_fprop_implicit_gemm_f16f16_f16f16_f16_nhwckrsc_nhwc_tilesize256x128x32_stage3_warpsize4x2x1_g1_tensor16x8x16_t1r3s3 Tactic: 0x048d6d0400f33439 Time: 1.52351
[11/13/2025-13:36:57] [V] [TRT] Tactic Name: sm80_xmma_fprop_implicit_gemm_f16f16_f16f16_f16_nhwckrsc_nhwc_tilesize256x64x64_stage3_warpsize4x1x1_g1_tensor16x8x16 Tactic: 0xeb25062ffb9eae45 Time: 1.98128
[11/13/2025-13:36:57] [V] [TRT] Fast skip Tactic:0xe1ff5ad20f5c6bf6 which exceed time limit during pre-run
[11/13/2025-13:36:57] [V] [TRT] Tactic Name: sm80_xmma_fprop_implicit_gemm_indexed_f16f16_f16f16_f16_nhwckrsc_nhwc_tilesize64x32x64_stage5_warpsize2x2x1_g1_tensor16x8x16 Tactic: 0xe1ff5ad20f5c6bf6 Time: 4.04582
[11/13/2025-13:36:57] [V] [TRT] Tactic Name: sm80_xmma_fprop_implicit_gemm_indexed_f16f16_f16f16_f16_nhwckrsc_nhwc_tilesize128x64x32_stage5_warpsize2x2x1_g1_tensor16x8x16 Tactic: 0xc9d24bd069159fa8 Time: 2.47466
[11/13/2025-13:36:57] [V] [TRT] Tactic Name: sm80_xmma_fprop_implicit_gemm_indexed_f16f16_f16f16_f16_nhwckrsc_nhwc_tilesize128x64x64_stage3_warpsize2x2x1_g1_tensor16x8x16 Tactic: 0x21b295c0c8f6c95a Time: 2.16618
[11/13/2025-13:36:57] [V] [TRT] Tactic Name: sm80_xmma_fprop_implicit_gemm_indexed_f16f16_f16f16_f16_nhwckrsc_nhwc_tilesize128x128x32_stage4_warpsize2x2x1_g1_tensor16x8x16 Tactic: 0x0e07ff4f4f7c1ac9 Time: 1.68277
[11/13/2025-13:36:57] [V] [TRT] Tactic Name: sm80_xmma_fprop_implicit_gemm_indexed_f16f16_f16f16_f16_nhwckrsc_nhwc_tilesize128x128x64_stage3_warpsize2x2x1_g1_tensor16x8x16 Tactic: 0x866e7a5f6401b67f Time: 1.71911
[11/13/2025-13:36:58] [V] [TRT] Tactic Name: sm80_xmma_fprop_implicit_gemm_f16f16_f16f16_f16_nhwckrsc_nhwc_tilesize64x64x64_stage4_warpsize2x2x1_g1_tensor16x8x16_t1r3s3_aACCESS Tactic: 0x30e8a8d7a953e5e9 Time: 2.55244
[11/13/2025-13:36:58] [V] [TRT] Tactic Name: sm80_xmma_fprop_implicit_gemm_f16f16_f16f16_f16_nhwckrsc_nhwc_tilesize64x64x64_stage4_warpsize2x2x1_g1_tensor16x8x16_t1r3s3 Tactic: 0x31d93dc22d2af081 Time: 2.72805
[11/13/2025-13:36:58] [V] [TRT] Fast skip Tactic:0xdce100b9fe609424 which exceed time limit during pre-run
[11/13/2025-13:36:58] [V] [TRT] Tactic Name: sm80_xmma_fprop_implicit_gemm_indexed_f16f16_f16f16_f16_nhwckrsc_nhwc_tilesize256x32x32_stage4_warpsize4x1x1_g1_tensor16x8x16 Tactic: 0xdce100b9fe609424 Time: 3.72819
[11/13/2025-13:36:58] [V] [TRT] Tactic Name: sm80_xmma_fprop_implicit_gemm_f16f16_f16f16_f16_nhwckrsc_nhwc_tilesize64x64x64_stage4_warpsize2x2x1_g1_tensor16x8x16 Tactic: 0xf35e0311fa1cc516 Time: 2.72262
[11/13/2025-13:36:58] [V] [TRT] Tactic Name: sm80_xmma_fprop_implicit_gemm_indexed_f16f16_f16f16_f16_nhwckrsc_nhwc_tilesize256x128x32_stage3_warpsize4x2x1_g1_tensor16x8x16 Tactic: 0xb17d53d15dfbfc9e Time: 1.53509
[11/13/2025-13:36:58] [V] [TRT] Tactic Name: sm80_xmma_fprop_implicit_gemm_f16f16_f16f16_f16_nhwckrsc_nhwc_tilesize128x64x64_stage4_warpsize2x1x2_g1_tensor16x8x16 Tactic: 0x7273dde1d0cd3bd5 Time: 2.2454
[11/13/2025-13:36:58] [V] [TRT] Tactic Name: sm80_xmma_fprop_implicit_gemm_f16f16_f16f16_f16_nhwckrsc_nhwc_tilesize128x64x32_stage5_warpsize2x2x1_g1_tensor16x8x16_t1r3s3 Tactic: 0xb4bec086187edcfc Time: 2.47556
[11/13/2025-13:36:58] [V] [TRT] Fast skip Tactic:0xf79479a62ea9f901 which exceed time limit during pre-run
[11/13/2025-13:36:58] [V] [TRT] Tactic Name: sm80_xmma_fprop_implicit_gemm_indexed_f16f16_f16f16_f16_nhwckrsc_nhwc_tilesize128x32x32_stage4_warpsize4x1x1_g1_tensor16x8x16 Tactic: 0xf79479a62ea9f901 Time: 4.11936
[11/13/2025-13:36:58] [V] [TRT] Tactic Name: sm80_xmma_fprop_implicit_gemm_f16f16_f16f16_f16_nhwckrsc_nhwc_tilesize64x128x32_stage5_warpsize2x2x1_g1_tensor16x8x16_t1r3s3 Tactic: 0x17ebf0c9f418f10a Time: 2.46039
[11/13/2025-13:36:58] [V] [TRT] Tactic Name: sm80_xmma_fprop_implicit_gemm_f16f16_f16f16_f16_nhwckrsc_nhwc_tilesize128x64x64_stage3_warpsize2x2x1_g1_tensor16x8x16_t1r3s3 Tactic: 0x05b6220f243edacd Time: 2.11086
[11/13/2025-13:36:58] [V] [TRT] Tactic Name: sm80_xmma_fprop_implicit_gemm_indexed_f16f16_f16f16_f16_nhwckrsc_nhwc_tilesize256x64x64_stage3_warpsize4x1x1_g1_tensor16x8x16 Tactic: 0x9fff6e65019cc310 Time: 2.06281
[11/13/2025-13:36:58] [V] [TRT] Tactic Name: sm80_xmma_fprop_implicit_gemm_f16f16_f16f16_f16_nhwckrsc_nhwc_tilesize128x64x64_stage3_warpsize2x2x1_g1_tensor16x8x16 Tactic: 0x5568fd8a32f4a40f Time: 2.12649
[11/13/2025-13:36:58] [V] [TRT] Tactic Name: sm80_xmma_fprop_implicit_gemm_f16f16_f16f16_f16_nhwckrsc_nhwc_tilesize64x64x64_stage4_warpsize2x1x2_g1_tensor16x8x16_aACCESS Tactic: 0x841c601dec2a75bc Time: 2.41903
[11/13/2025-13:36:58] [V] [TRT] Tactic Name: sm80_xmma_fprop_implicit_gemm_f16f16_f16f16_f16_nhwckrsc_nhwc_tilesize128x64x64_stage5_warpsize2x1x2_g1_tensor16x8x16_aACCESS Tactic: 0x8bfc020aee55171f Time: 2.26256
[11/13/2025-13:36:58] [V] [TRT] Tactic Name: sm80_xmma_fprop_implicit_gemm_f16f16_f16f16_f16_nhwckrsc_nhwc_tilesize256x64x64_stage3_warpsize4x1x1_g1_tensor16x8x16_t1r3s3 Tactic: 0x84ee897dd1f4d2aa Time: 1.96461
[11/13/2025-13:36:58] [V] [TRT] Tactic Name: sm80_xmma_fprop_implicit_gemm_f16f16_f16f16_f16_nhwckrsc_nhwc_tilesize256x64x32_stage3_warpsize4x1x1_g1_tensor16x8x16 Tactic: 0xd1aaad17ca35fbaa Time: 2.07277
[11/13/2025-13:36:58] [V] [TRT] Tactic Name: sm80_xmma_fprop_implicit_gemm_f16f16_f16f16_f16_nhwckrsc_nhwc_tilesize256x128x32_stage3_warpsize4x2x1_g1_tensor16x8x16 Tactic: 0x60da8c7151d91e47 Time: 1.49571
[11/13/2025-13:36:58] [V] [TRT] Tactic Name: sm80_xmma_fprop_implicit_gemm_indexed_f16f16_f16f16_f16_nhwckrsc_nhwc_tilesize256x128x64_stage3_warpsize4x2x1_g1_tensor16x8x16 Tactic: 0x8bf2f8e96c50a971 Time: 1.64643
[11/13/2025-13:36:58] [V] [TRT] Tactic Name: sm80_xmma_fprop_implicit_gemm_f16f16_f16f16_f16_nhwckrsc_nhwc_tilesize64x128x32_stage5_warpsize2x2x1_g1_tensor16x8x16 Tactic: 0xdb0b80f591d1bb6d Time: 2.47022
[11/13/2025-13:36:58] [V] [TRT] Fast skip Tactic:0xded5318b4a444b84 which exceed time limit during pre-run
[11/13/2025-13:36:58] [V] [TRT] Tactic Name: sm80_xmma_fprop_wngd_f16f16_f16_f16_nhwckrsc_nhwc_tilesize8x16x32x32_warpsize8x1x1_wngd2x2 Tactic: 0xded5318b4a444b84 Time: 6.27085
[11/13/2025-13:36:58] [V] [TRT] Fast skip Tactic:0xa83b68f30462f971 which exceed time limit during pre-run
[11/13/2025-13:36:58] [V] [TRT] Tactic Name: sm80_xmma_fprop_implicit_gemm_f16f16_f16f16_f16_nhwckrsc_nhwc_tilesize256x32x32_stage4_warpsize4x1x1_g1_tensor16x8x16 Tactic: 0xa83b68f30462f971 Time: 3.72134
[11/13/2025-13:36:58] [V] [TRT] Tactic Name: sm80_xmma_fprop_implicit_gemm_indexed_f16f16_f16f16_f16_nhwckrsc_nhwc_tilesize64x64x64_stage4_warpsize2x2x1_g1_tensor16x8x16 Tactic: 0x4a81ea1e51436a30 Time: 2.75157
[11/13/2025-13:36:58] [V] [TRT] Tactic Name: sm80_xmma_fprop_implicit_gemm_f16f16_f16f16_f16_nhwckrsc_nhwc_tilesize128x128x64_stage3_warpsize2x2x1_g1_tensor16x8x16_t1r3s3 Tactic: 0xc0a02dc6095497cc Time: 1.70536
[11/13/2025-13:36:58] [V] [TRT] Fast skip Tactic:0x3e7eb35b91b9fa63 which exceed time limit during pre-run
[11/13/2025-13:36:58] [V] [TRT] Tactic Name: sm80_xmma_fprop_implicit_gemm_f16f16_f16f16_f16_nhwckrsc_nhwc_tilesize128x32x32_stage4_warpsize4x1x1_g1_tensor16x8x16_t1r3s3 Tactic: 0x3e7eb35b91b9fa63 Time: 4.1152
[11/13/2025-13:36:58] [V] [TRT] Tactic Name: sm80_xmma_fprop_implicit_gemm_indexed_f16f16_f16f16_f16_nhwckrsc_nhwc_tilesize256x64x32_stage3_warpsize4x1x1_g1_tensor16x8x16 Tactic: 0xa570c55d303796ff Time: 2.08009
[11/13/2025-13:36:58] [V] [TRT] Tactic Name: sm80_xmma_fprop_implicit_gemm_f16f16_f16f16_f16_nhwckrsc_nhwc_tilesize64x256x64_stage3_warpsize1x4x1_g1_tensor16x8x16 Tactic: 0x29dc14520e0e4eb6 Time: 1.89648
[11/13/2025-13:36:58] [V] [TRT] Tactic Name: sm80_xmma_fprop_implicit_gemm_indexed_f16f16_f16f16_f16_nhwckrsc_nhwc_tilesize64x128x32_stage5_warpsize2x2x1_g1_tensor16x8x16 Tactic: 0xafd1e8bf6bd3d638 Time: 2.46912
[11/13/2025-13:36:58] [V] [TRT] Fast skip Tactic:0xe29800439b9d3cf7 which exceed time limit during pre-run
[11/13/2025-13:36:58] [V] [TRT] Tactic Name: sm80_xmma_fprop_wngd_f16f16_f16_f16_nhwckrsc_nhwc_tilesize16x16x64x16_warpsize8x1x1_wngd2x2 Tactic: 0xe29800439b9d3cf7 Time: 4.00394
[11/13/2025-13:36:58] [V] [TRT] Tactic Name: sm80_xmma_fprop_implicit_gemm_indexed_f16f16_f16f16_f16_nhwckrsc_nhwc_tilesize128x256x32_stage3_warpsize2x4x1_g1_tensor16x8x16 Tactic: 0x7005d10718f6c22d Time: 1.60664
[11/13/2025-13:36:58] [V] [TRT] Tactic Name: sm80_xmma_fprop_implicit_gemm_f16f16_f16f16_f16_nhwckrsc_nhwc_tilesize64x256x64_stage3_warpsize1x4x1_g1_tensor16x8x16_t1r3s3 Tactic: 0xd7c261fa01db2af9 Time: 1.92139
[11/13/2025-13:36:58] [V] [TRT] Tactic Name: sm80_xmma_fprop_implicit_gemm_f16f16_f16f16_f16_nhwckrsc_nhwc_tilesize256x64x32_stage3_warpsize4x1x1_g1_tensor16x8x16_t1r3s3 Tactic: 0x529f4431bdae94f5 Time: 2.07381
[11/13/2025-13:36:58] [V] [TRT] Fast skip Tactic:0xa40cb43c296a36a8 which exceed time limit during pre-run
[11/13/2025-13:36:58] [V] [TRT] Tactic Name: sm80_xmma_fprop_implicit_gemm_f16f16_f16f16_f16_nhwckrsc_nhwc_tilesize256x32x32_stage4_warpsize4x1x1_g1_tensor16x8x16_t1r3s3 Tactic: 0xa40cb43c296a36a8 Time: 3.72272
[11/13/2025-13:36:58] [V] [TRT] Tactic Name: sm80_xmma_fprop_implicit_gemm_indexed_f16f16_f16f16_f16_nhwckrsc_nhwc_tilesize64x256x64_stage3_warpsize1x4x1_g1_tensor16x8x16 Tactic: 0x5d067c18f40c23e3 Time: 1.92016
[11/13/2025-13:36:58] [V] [TRT] Tactic Name: sm80_xmma_fprop_implicit_gemm_f16f16_f16f16_f16_nhwckrsc_nhwc_tilesize128x64x64_stage3_warpsize2x2x1_g1_tensor16x8x16_t1r3s3_aACCESS Tactic: 0x263a38afd75e3a43 Time: 2.14805
[11/13/2025-13:36:58] [V] [TRT] Conv_1 + Relu_2 (CaskConvolution[0x80000009]) profiling completed in 1.48772 seconds. Fastest Tactic: 0x60da8c7151d91e47 Time: 1.49571
[11/13/2025-13:36:58] [V] [TRT] Skipping CaskFlattenConvolution: No valid tactics for Conv_1 + Relu_2
[11/13/2025-13:36:58] [V] [TRT] >>>>>>>>>>>>>>> Chose Runner Type: CaskConvolution Tactic: 0x60da8c7151d91e47
[11/13/2025-13:36:58] [V] [TRT] =============== Computing costs for Conv_3 + Relu_4
[11/13/2025-13:36:58] [V] [TRT] *************** Autotuning format combination: Float(8294400,32400,180,1) -> Float(4147200,32400,180,1) ***************
[11/13/2025-13:36:58] [V] [TRT] --------------- Timing Runner: Conv_3 + Relu_4 (CaskConvolution[0x80000009])
[11/13/2025-13:36:59] [V] [TRT] Tactic Name: ampere_scudnn_128x128_relu_small_nn_v1 Tactic: 0x503619c69ae500ff Time: 6.07378
[11/13/2025-13:36:59] [V] [TRT] Tactic Name: ampere_scudnn_128x128_relu_medium_nn_v1 Tactic: 0xf067e6205da31c2e Time: 5.79424
[11/13/2025-13:36:59] [V] [TRT] Tactic Name: ampere_scudnn_128x64_relu_xregs_large_nn_v1 Tactic: 0x5deb29b7a8e275f7 Time: 6.21249
[11/13/2025-13:36:59] [V] [TRT] Tactic Name: sm80_xmma_fprop_implicit_gemm_indexed_f32f32_f32f32_f32_nchwkcrs_nchw_tilesize128x64x8_stage2_warpsize2x2x1_g1_ffma_aligna4_alignc4_beta0_packed_stride Tactic: 0x31aa67f57c5aea77 Time: 7.07702
[11/13/2025-13:36:59] [V] [TRT] Tactic Name: sm80_xmma_fprop_implicit_gemm_f32f32_f32f32_f32_nchwkcrs_nchw_tilesize64x64x8_stage3_warpsize1x4x1_g1_ffma_aligna4_alignc4 Tactic: 0xa31d27de74b895ff Time: 6.46406
[11/13/2025-13:36:59] [V] [TRT] Tactic Name: sm80_xmma_fprop_implicit_gemm_indexed_f32f32_f32f32_f32_nchwkcrs_nchw_tilesize128x32x8_stage3_warpsize2x2x1_g1_ffma_aligna4_alignc4 Tactic: 0xa9366041633a5135 Time: 11.5622
[11/13/2025-13:36:59] [V] [TRT] Tactic Name: sm80_xmma_fprop_implicit_gemm_f32f32_f32f32_f32_nchwkcrs_nchw_tilesize64x128x8_stage3_warpsize1x4x1_g1_ffma_aligna4_alignc4 Tactic: 0x5aa723e0481da855 Time: 5.59933
[11/13/2025-13:36:59] [V] [TRT] Tactic Name: sm80_xmma_fprop_wngd_f32f32_f32_f32_nchwkcrs_nchw_tilesize8x16x32x8_warpsize8x1x1_wngd2x2 Tactic: 0xe47e164f4a743900 Time: 5.08244
[11/13/2025-13:36:59] [V] [TRT] Tactic Name: ampere_scudnn_128x64_relu_small_nn_v1 Tactic: 0x3f243c490d502deb Time: 6.51493
[11/13/2025-13:36:59] [V] [TRT] Tactic Name: sm80_xmma_fprop_implicit_gemm_f32f32_f32f32_f32_nchwkcrs_nchw_tilesize64x128x8_stage3_warpsize1x4x1_g1_ffma_t1r3s3_aligna4_alignc4 Tactic: 0x01cf8ce2da913006 Time: 5.61579
[11/13/2025-13:36:59] [V] [TRT] Tactic Name: sm80_xmma_fprop_implicit_gemm_f32f32_f32f32_f32_nchwkcrs_nchw_tilesize128x64x8_stage2_warpsize2x2x1_g1_ffma_t1r3s3_aligna4_alignc4_beta0_packed_stride Tactic: 0x3712e3e595645874 Time: 5.51934
[11/13/2025-13:36:59] [V] [TRT] Tactic Name: sm80_xmma_fprop_implicit_gemm_f32f32_f32f32_f32_nchwkcrs_nchw_tilesize32x32x8_stage3_warpsize1x2x1_g1_ffma_t1r3s3_aligna4_alignc4 Tactic: 0x8ad32616b1424be4 Time: 8.73561
[11/13/2025-13:36:59] [V] [TRT] Tactic Name: sm80_xmma_fprop_implicit_gemm_f32f32_f32f32_f32_nchwkcrs_nchw_tilesize64x64x8_stage3_warpsize1x4x1_g1_ffma_t1r3s3_aligna4_alignc4 Tactic: 0x4727434768e46395 Time: 6.32633
[11/13/2025-13:37:00] [V] [TRT] Tactic Name: sm80_xmma_fprop_implicit_gemm_f32f32_f32f32_f32_nchwkcrs_nchw_tilesize256x128x8_stage3_warpsize4x2x1_g1_ffma_t1r3s3_aligna4_alignc4 Tactic: 0x4efce38acc876f5c Time: 5.03645
[11/13/2025-13:37:00] [V] [TRT] Tactic Name: sm80_xmma_fprop_implicit_gemm_indexed_f32f32_f32f32_f32_nchwkcrs_nchw_tilesize128x64x8_stage2_warpsize4x1x1_g1_ffma_aligna4_alignc4_beta0_packed_stride Tactic: 0x1673e3594ce11cea Time: 8.04258
[11/13/2025-13:37:00] [V] [TRT] Fast skip Tactic:0x40a12e3938221818 which exceed time limit during pre-run
[11/13/2025-13:37:00] [V] [TRT] Tactic Name: sm80_xmma_fprop_implicit_gemm_indexed_f32f32_f32f32_f32_nchwkcrs_nchw_tilesize128x16x8_stage3_warpsize4x1x1_g1_ffma_aligna4_alignc4 Tactic: 0x40a12e3938221818 Time: 18.2153
[11/13/2025-13:37:00] [V] [TRT] Fast skip Tactic:0xcb8a43f748d8a338 which exceed time limit during pre-run
[11/13/2025-13:37:00] [V] [TRT] Tactic Name: sm80_xmma_fprop_implicit_gemm_indexed_f32f32_f32f32_f32_nchwkcrs_nchw_tilesize32x32x8_stage3_warpsize1x2x1_g1_ffma_aligna4_alignc4 Tactic: 0xcb8a43f748d8a338 Time: 12.2872
[11/13/2025-13:37:00] [V] [TRT] Tactic Name: sm80_xmma_fprop_wngd_f32f32_f32_f32_nchwkcrs_nchw_tilesize8x16x64x8_warpsize8x1x1_wngd2x2 Tactic: 0x0190806602534cfd Time: 3.38511
[11/13/2025-13:37:00] [V] [TRT] Fast skip Tactic:0xede36641840ce3d2 which exceed time limit during pre-run
[11/13/2025-13:37:00] [V] [TRT] Tactic Name: sm80_xmma_fprop_implicit_gemm_indexed_f32f32_f32f32_f32_nchwkcrs_nchw_tilesize128x64x8_stage2_warpsize1x4x1_g1_ffma_aligna4_alignc4_beta0_packed_stride Tactic: 0xede36641840ce3d2 Time: 8.13056
[11/13/2025-13:37:00] [V] [TRT] Fast skip Tactic:0x9d9fdb5fd9945f64 which exceed time limit during pre-run
[11/13/2025-13:37:00] [V] [TRT] Tactic Name: sm80_xmma_fprop_implicit_gemm_f32f32_f32f32_f32_nchwkcrs_nchw_tilesize128x16x8_stage3_warpsize4x1x1_g1_ffma_aligna4_alignc4 Tactic: 0x9d9fdb5fd9945f64 Time: 11.1926
[11/13/2025-13:37:00] [V] [TRT] Tactic Name: sm80_xmma_fprop_implicit_gemm_f32f32_f32f32_f32_nchwkcrs_nchw_tilesize256x128x8_stage3_warpsize4x2x1_g1_ffma_aligna4_alignc4 Tactic: 0xbb8c3889c7eacd30 Time: 5.0562
[11/13/2025-13:37:00] [V] [TRT] Tactic Name: sm80_xmma_fprop_implicit_gemm_f32f32_f32f32_f32_nchwkcrs_nchw_tilesize128x64x8_stage2_warpsize1x4x1_g1_ffma_t1r3s3_aligna4_alignc4_beta0_packed_stride Tactic: 0x7fc93550f5b9c127 Time: 5.99736
[11/13/2025-13:37:00] [V] [TRT] Tactic Name: ampere_scudnn_winograd_128x128_ldg1_ldg4_relu_tile148t_nt_v1 Tactic: 0x94119b4c514b211a Time: 3.5866
[11/13/2025-13:37:00] [V] [TRT] Fast skip Tactic:0xd828f024626fa982 which exceed time limit during pre-run
[11/13/2025-13:37:00] [V] [TRT] Tactic Name: sm80_xmma_fprop_implicit_gemm_indexed_f32f32_f32f32_f32_nchwkcrs_nchw_tilesize64x64x8_stage3_warpsize1x4x1_g1_ffma_aligna4_alignc4 Tactic: 0xd828f024626fa982 Time: 8.3049
[11/13/2025-13:37:00] [V] [TRT] Tactic Name: sm80_xmma_fprop_implicit_gemm_f32f32_f32f32_f32_nchwkcrs_nchw_tilesize128x64x8_stage2_warpsize4x1x1_g1_ffma_t1r3s3_aligna4_alignc4_beta0_packed_stride Tactic: 0xe640ceafd7d34ca9 Time: 6.30194
[11/13/2025-13:37:00] [V] [TRT] Fast skip Tactic:0xb0bf940d5e0f9f45 which exceed time limit during pre-run
[11/13/2025-13:37:00] [V] [TRT] Tactic Name: sm80_xmma_fprop_implicit_gemm_f32f32_f32f32_f32_nchwkcrs_nchw_tilesize32x32x8_stage3_warpsize1x2x1_g1_ffma_aligna4_alignc4 Tactic: 0xb0bf940d5e0f9f45 Time: 8.80618
[11/13/2025-13:37:00] [V] [TRT] Fast skip Tactic:0xa8609adc4e0ceb90 which exceed time limit during pre-run
[11/13/2025-13:37:00] [V] [TRT] Tactic Name: ampere_scudnn_128x32_relu_small_nn_v1 Tactic: 0xa8609adc4e0ceb90 Time: 7.26525
[11/13/2025-13:37:00] [V] [TRT] Tactic Name: sm80_xmma_fprop_implicit_gemm_f32f32_f32f32_f32_nchwkcrs_nchw_tilesize128x64x8_stage3_warpsize2x2x1_g1_ffma_aligna4_alignc4 Tactic: 0x12dbf7d94ee3696d Time: 6.13552
[11/13/2025-13:37:00] [V] [TRT] Tactic Name: sm80_xmma_fprop_wngd_f32f32_f32_f32_nchwkcrs_nchw_tilesize8x16x16x8_warpsize8x1x1_wngd2x2 Tactic: 0xe38e9dfd56c33779 Time: 4.61233
[11/13/2025-13:37:00] [V] [TRT] Tactic Name: ampere_scudnn_128x64_relu_medium_nn_v1 Tactic: 0xf64396b97c889179 Time: 6.64076
[11/13/2025-13:37:00] [V] [TRT] Conv_3 + Relu_4 (CaskConvolution[0x80000009]) profiling completed in 1.91203 seconds. Fastest Tactic: 0x0190806602534cfd Time: 3.38511
[11/13/2025-13:37:00] [V] [TRT] Skipping CaskFlattenConvolution: No valid tactics for Conv_3 + Relu_4
[11/13/2025-13:37:00] [V] [TRT] >>>>>>>>>>>>>>> Chose Runner Type: CaskConvolution Tactic: 0x0190806602534cfd
[11/13/2025-13:37:00] [V] [TRT] *************** Autotuning format combination: Float(8294400,1,46080,256) -> Float(4147200,1,23040,128) ***************
[11/13/2025-13:37:00] [V] [TRT] --------------- Timing Runner: Conv_3 + Relu_4 (CaskConvolution[0x80000009])
[11/13/2025-13:37:00] [V] [TRT] Tactic Name: sm80_xmma_fprop_implicit_gemm_f32f32_f32f32_f32_nhwckrsc_nhwc_tilesize64x64x8_stage3_warpsize1x4x1_g1_ffma_t1r3s3_aligna4_alignc4 Tactic: 0x94a7db94ba744c45 Time: 6.04506
[11/13/2025-13:37:01] [V] [TRT] Tactic Name: sm80_xmma_fprop_implicit_gemm_f32f32_f32f32_f32_nhwckrsc_nhwc_tilesize128x64x8_stage3_warpsize2x2x1_g1_ffma_t1r3s3_aligna4_alignc4 Tactic: 0xf48db81f02eca9ee Time: 5.39794
[11/13/2025-13:37:01] [V] [TRT] Tactic Name: sm80_xmma_fprop_implicit_gemm_f32f32_f32f32_f32_nhwckrsc_nhwc_tilesize64x256x8_stage3_warpsize1x4x1_g1_ffma_t1r3s3_aligna4_alignc4 Tactic: 0x3f0c846d6379bc98 Time: 9.63061
[11/13/2025-13:37:01] [V] [TRT] Tactic Name: sm80_xmma_fprop_implicit_gemm_indexed_f32f32_f32f32_f32_nhwckrsc_nhwc_tilesize32x32x8_stage3_warpsize1x2x1_g1_ffma_aligna4_alignc4 Tactic: 0x0a143be7a52f301a Time: 10.6027
[11/13/2025-13:37:01] [V] [TRT] Tactic Name: sm80_xmma_fprop_implicit_gemm_f32f32_f32f32_f32_nhwckrsc_nhwc_tilesize64x128x8_stage3_warpsize1x4x1_g1_ffma_t1r3s3_aligna4_alignc4 Tactic: 0xd15dd11d64344e83 Time: 5.37643
[11/13/2025-13:37:01] [V] [TRT] Tactic Name: sm80_xmma_fprop_implicit_gemm_f32f32_f32f32_f32_nhwckrsc_nhwc_tilesize128x64x8_stage3_warpsize2x2x1_g1_ffma_aligna4_alignc4 Tactic: 0x1da91d865428f237 Time: 5.41543
[11/13/2025-13:37:01] [V] [TRT] Tactic Name: sm80_xmma_fprop_implicit_gemm_f32f32_f32f32_f32_nhwckrsc_nhwc_tilesize128x16x8_stage3_warpsize4x1x1_g1_ffma_aligna4_alignc4 Tactic: 0x92ed3100c35fc43e Time: 10.2505
[11/13/2025-13:37:01] [V] [TRT] Tactic Name: sm80_xmma_fprop_implicit_gemm_indexed_f32f32_f32f32_f32_nhwckrsc_nhwc_tilesize128x32x8_stage3_warpsize2x2x1_g1_ffma_aligna4_alignc4 Tactic: 0xa6448a1e79f1ca6f Time: 7.66791
[11/13/2025-13:37:01] [V] [TRT] Tactic Name: sm80_xmma_fprop_implicit_gemm_f32f32_f32f32_f32_nhwckrsc_nhwc_tilesize256x64x8_stage3_warpsize2x2x1_g1_ffma_aligna4_alignc4 Tactic: 0x8014228ec08b4d49 Time: 4.93404
[11/13/2025-13:37:01] [V] [TRT] Tactic Name: sm80_xmma_fprop_implicit_gemm_f32f32_f32f32_f32_nhwckrsc_nhwc_tilesize64x64x8_stage3_warpsize1x4x1_g1_ffma_aligna4_alignc4 Tactic: 0x62835fce994f06dd Time: 6.05233
[11/13/2025-13:37:01] [V] [TRT] Fast skip Tactic:0x4fd3c46622e98342 which exceed time limit during pre-run
[11/13/2025-13:37:01] [V] [TRT] Tactic Name: sm80_xmma_fprop_implicit_gemm_indexed_f32f32_f32f32_f32_nhwckrsc_nhwc_tilesize128x16x8_stage3_warpsize4x1x1_g1_ffma_aligna4_alignc4 Tactic: 0x4fd3c46622e98342 Time: 12.0207
[11/13/2025-13:37:01] [V] [TRT] Fast skip Tactic:0x32059de4888dfdda which exceed time limit during pre-run
[11/13/2025-13:37:01] [V] [TRT] Tactic Name: sm80_xmma_fprop_implicit_gemm_f32f32_f32f32_f32_nhwckrsc_nhwc_tilesize128x16x8_stage3_warpsize4x1x1_g1_ffma_t1r3s3_aligna4_alignc4 Tactic: 0x32059de4888dfdda Time: 10.182
[11/13/2025-13:37:01] [V] [TRT] Tactic Name: sm80_xmma_fprop_implicit_gemm_indexed_f32f32_f32f32_f32_nhwckrsc_nhwc_tilesize64x64x8_stage3_warpsize1x4x1_g1_ffma_aligna4_alignc4 Tactic: 0x19b688348f983aa0 Time: 6.74146
[11/13/2025-13:37:01] [V] [TRT] Tactic Name: sm80_xmma_fprop_implicit_gemm_f32f32_f32f32_f32_nhwckrsc_nhwc_tilesize32x32x8_stage3_warpsize1x2x1_g1_ffma_t1r3s3_aligna4_alignc4 Tactic: 0x5953bec563d26434 Time: 9.79109
[11/13/2025-13:37:02] [V] [TRT] Tactic Name: sm80_xmma_fprop_implicit_gemm_f32f32_f32f32_f32_nhwckrsc_nhwc_tilesize32x32x8_stage3_warpsize1x2x1_g1_ffma_aligna4_alignc4 Tactic: 0x7121ec1db3f80c67 Time: 9.79252
[11/13/2025-13:37:02] [V] [TRT] Conv_3 + Relu_4 (CaskConvolution[0x80000009]) profiling completed in 1.18464 seconds. Fastest Tactic: 0x8014228ec08b4d49 Time: 4.93404
[11/13/2025-13:37:02] [V] [TRT] Skipping CaskFlattenConvolution: No valid tactics for Conv_3 + Relu_4
[11/13/2025-13:37:02] [V] [TRT] >>>>>>>>>>>>>>> Chose Runner Type: CaskConvolution Tactic: 0x8014228ec08b4d49
[11/13/2025-13:37:02] [V] [TRT] *************** Autotuning format combination: Float(2073600,1:4,11520,64) -> Float(4147200,32400,180,1) ***************
[11/13/2025-13:37:02] [V] [TRT] --------------- Timing Runner: Conv_3 + Relu_4 (CaskConvolution[0x80000009])
[11/13/2025-13:37:02] [V] [TRT] Tactic Name: sm80_xmma_fprop_implicit_gemm_f32f32_tf32f32_f32_nhwckrsc_nchw_tilesize128x128x32_stage4_warpsize2x2x1_g1_tensor16x8x8_t1r3s3 Tactic: 0xd7390b594d1ce947 Time: 1.12436
[11/13/2025-13:37:02] [V] [TRT] Tactic Name: sm80_xmma_fprop_implicit_gemm_indexed_f32f32_tf32f32_f32_nhwckrsc_nchw_tilesize128x256x32_stage3_warpsize2x4x1_g1_tensor16x8x8 Tactic: 0xcd6c525a3239bae9 Time: 2.1149
[11/13/2025-13:37:02] [V] [TRT] Fast skip Tactic:0xd106f5c552452296 which exceed time limit during pre-run
[11/13/2025-13:37:02] [V] [TRT] Tactic Name: sm80_xmma_fprop_implicit_gemm_f32f32_tf32f32_f32_nhwckrsc_nchw_tilesize64x32x64_stage5_warpsize2x2x1_g1_tensor16x8x8_t1r3s3_alignc4 Tactic: 0xd106f5c552452296 Time: 2.91466
[11/13/2025-13:37:02] [V] [TRT] Tactic Name: sm80_xmma_fprop_implicit_gemm_f32f32_tf32f32_f32_nhwckrsc_nchw_tilesize128x64x32_stage5_warpsize2x2x1_g1_tensor16x8x8_alignc4 Tactic: 0x294c501bad19317c Time: 1.58261
[11/13/2025-13:37:02] [V] [TRT] Tactic Name: sm80_xmma_fprop_implicit_gemm_f32f32_tf32f32_f32_nhwckrsc_nchw_tilesize128x64x64_stage3_warpsize2x2x1_g1_tensor16x8x8_t1r3s3_alignc4 Tactic: 0x14ce6e2746cfbad7 Time: 1.60935
[11/13/2025-13:37:02] [V] [TRT] Tactic Name: sm80_xmma_fprop_implicit_gemm_f32f32_tf32f32_f32_nhwckrsc_nchw_tilesize128x128x16_stage4_warpsize2x2x1_g1_tensor16x8x8_t1r3s3_alignc4 Tactic: 0x1323e48791e2f671 Time: 1.192
[11/13/2025-13:37:02] [V] [TRT] Tactic Name: sm80_xmma_fprop_implicit_gemm_f32f32_tf32f32_f32_nhwckrsc_nchw_tilesize128x128x16_stage4_warpsize2x2x1_g1_tensor16x8x8_alignc4 Tactic: 0x9fd9fe001908ce2e Time: 1.21703
[11/13/2025-13:37:02] [V] [TRT] Tactic Name: sm80_xmma_fprop_implicit_gemm_f32f32_tf32f32_f32_nhwckrsc_nchw_tilesize128x128x32_stage4_warpsize2x2x1_g1_tensor16x8x8_t1r3s3_alignc4 Tactic: 0xc50ec1760635de6f Time: 1.13354
[11/13/2025-13:37:02] [V] [TRT] Fast skip Tactic:0xf5c5ffdea9383daa which exceed time limit during pre-run
[11/13/2025-13:37:02] [V] [TRT] Tactic Name: sm80_xmma_fprop_implicit_gemm_f32f32_tf32f32_f32_nhwckrsc_nchw_tilesize64x32x64_stage5_warpsize2x2x1_g1_tensor16x8x8_t1r3s3 Tactic: 0xf5c5ffdea9383daa Time: 2.91162
[11/13/2025-13:37:02] [V] [TRT] Tactic Name: sm80_xmma_fprop_implicit_gemm_f32f32_tf32f32_f32_nhwckrsc_nchw_tilesize64x64x64_stage4_warpsize2x2x1_g1_tensor16x8x8_t1r3s3 Tactic: 0xbfdf05725bf3ea6d Time: 2.01796
[11/13/2025-13:37:02] [V] [TRT] Tactic Name: sm80_xmma_fprop_implicit_gemm_f32f32_tf32f32_f32_nhwckrsc_nchw_tilesize128x64x32_stage5_warpsize2x2x1_g1_tensor16x8x8 Tactic: 0xa95e2a26416587cd Time: 1.55613
[11/13/2025-13:37:02] [V] [TRT] Tactic Name: sm80_xmma_fprop_implicit_gemm_f32f32_tf32f32_f32_nhwckrsc_nchw_tilesize256x128x32_stage3_warpsize4x2x1_g1_tensor16x8x8_t1r3s3 Tactic: 0x2f3dd4e092216107 Time: 1.09667
[11/13/2025-13:37:02] [V] [TRT] Tactic Name: sm80_xmma_fprop_implicit_gemm_indexed_f32f32_tf32f32_f32_nhwckrsc_nchw_tilesize128x128x16_stage4_warpsize2x2x1_g1_tensor16x8x8_alignc4 Tactic: 0xe8f7b6a5bab325f8 Time: 1.2938
[11/13/2025-13:37:02] [V] [TRT] Tactic Name: sm80_xmma_fprop_implicit_gemm_indexed_f32f32_tf32f32_f32_nhwckrsc_nchw_tilesize128x256x32_stage3_warpsize2x4x1_g1_tensor16x8x8_alignc4 Tactic: 0xbf7080aca6804022 Time: 2.10757
[11/13/2025-13:37:02] [V] [TRT] Tactic Name: sm80_xmma_fprop_implicit_gemm_f32f32_tf32f32_f32_nhwckrsc_nchw_tilesize64x128x32_stage5_warpsize2x2x1_g1_tensor16x8x8_t1r3s3 Tactic: 0xec566784128c4eda Time: 1.56825
[11/13/2025-13:37:02] [V] [TRT] Tactic Name: sm80_xmma_fprop_implicit_gemm_indexed_f32f32_tf32f32_f32_nhwckrsc_nchw_tilesize128x128x16_stage4_warpsize2x2x1_g1_tensor16x8x8 Tactic: 0xe0a307ffe0ffb6a5 Time: 1.30697
[11/13/2025-13:37:02] [V] [TRT] Tactic Name: sm80_xmma_fprop_implicit_gemm_indexed_f32f32_tf32f32_f32_nhwckrsc_nchw_tilesize256x64x32_stage3_warpsize4x2x1_g1_tensor16x8x8 Tactic: 0x7449ed93fb7feabf Time: 1.47487
[11/13/2025-13:37:02] [V] [TRT] Tactic Name: sm80_xmma_fprop_implicit_gemm_f32f32_tf32f32_f32_nhwckrsc_nchw_tilesize128x128x32_stage4_warpsize2x2x1_g1_tensor16x8x8 Tactic: 0xa0f5a3abd9b9c82a Time: 1.12968
[11/13/2025-13:37:02] [V] [TRT] Tactic Name: sm80_xmma_fprop_implicit_gemm_f32f32_tf32f32_f32_nhwckrsc_nchw_tilesize256x64x32_stage3_warpsize4x2x1_g1_tensor16x8x8 Tactic: 0x009385d9017d87ea Time: 1.40633
[11/13/2025-13:37:02] [V] [TRT] Tactic Name: sm80_xmma_fprop_implicit_gemm_f32f32_tf32f32_f32_nhwckrsc_nchw_tilesize64x128x32_stage5_warpsize2x2x1_g1_tensor16x8x8 Tactic: 0xabbf7eb3b5b99502 Time: 1.55433
[11/13/2025-13:37:02] [V] [TRT] Tactic Name: sm80_xmma_fprop_implicit_gemm_f32f32_tf32f32_f32_nhwckrsc_nchw_tilesize128x256x32_stage3_warpsize2x4x1_g1_tensor16x8x8_t1r3s3 Tactic: 0x6f57319253e043c7 Time: 2.04503
[11/13/2025-13:37:02] [V] [TRT] Tactic Name: sm80_xmma_fprop_implicit_gemm_f32f32_tf32f32_f32_nhwckrsc_nchw_tilesize128x64x32_stage5_warpsize2x2x1_g1_tensor16x8x8_t1r3s3_alignc4 Tactic: 0x2bf0858f240ff918 Time: 1.55832
[11/13/2025-13:37:02] [V] [TRT] Tactic Name: sm80_xmma_fprop_implicit_gemm_f32f32_tf32f32_f32_nhwckrsc_nchw_tilesize64x128x32_stage5_warpsize2x2x1_g1_tensor16x8x8_alignc4 Tactic: 0x8a196054417f1c8a Time: 1.62561
[11/13/2025-13:37:02] [V] [TRT] Tactic Name: sm80_xmma_fprop_implicit_gemm_indexed_f32f32_tf32f32_f32_nhwckrsc_nchw_tilesize128x64x32_stage5_warpsize2x2x1_g1_tensor16x8x8 Tactic: 0xdd84426cbb67ea98 Time: 1.61169
[11/13/2025-13:37:02] [V] [TRT] Tactic Name: sm80_xmma_fprop_implicit_gemm_f32f32_tf32f32_f32_nhwckrsc_nchw_tilesize128x64x32_stage5_warpsize2x2x1_g1_tensor16x8x8_t1r3s3 Tactic: 0x42b6ff75b94b8cbd Time: 1.56016
[11/13/2025-13:37:02] [V] [TRT] Tactic Name: sm80_xmma_fprop_implicit_gemm_f32f32_tf32f32_f32_nhwckrsc_nchw_tilesize256x128x32_stage3_warpsize4x2x1_g1_tensor16x8x8 Tactic: 0x62d0fae781700403 Time: 1.16772
[11/13/2025-13:37:02] [V] [TRT] Fast skip Tactic:0x7c012183b88ca724 which exceed time limit during pre-run
[11/13/2025-13:37:02] [V] [TRT] Tactic Name: sm80_xmma_fprop_implicit_gemm_f32f32_tf32f32_f32_nhwckrsc_nchw_tilesize64x64x64_stage4_warpsize2x2x1_g1_tensor16x8x8 Tactic: 0x7c012183b88ca724 Time: 2.20659
