src/perception/ros2_bevfusion/models/resnet50int8/build/camera.vtransform.log
[06/23/2025-11:22:34] [V] [TRT] *************** Autotuning format combination: Float(10368000,129600,360,1) -> Float(10368000,129600,360,1) ***************
[06/23/2025-11:22:34] [V] [TRT] --------------- Timing Runner: Conv_0 + Relu_1 (CaskConvolution[0x80000009])
[06/23/2025-11:22:34] [V] [TRT] Tactic Name: ampere_scudnn_128x128_relu_small_nn_v1 Tactic: 0x503619c69ae500ff Time: 13.7545
[06/23/2025-11:22:34] [V] [TRT] Tactic Name: ampere_scudnn_128x128_relu_medium_nn_v1 Tactic: 0xf067e6205da31c2e Time: 11.7641
[06/23/2025-11:22:35] [V] [TRT] Tactic Name: ampere_scudnn_128x64_relu_xregs_large_nn_v1 Tactic: 0x5deb29b7a8e275f7 Time: 12.4312
[06/23/2025-11:22:35] [V] [TRT] Tactic Name: sm80_xmma_fprop_implicit_gemm_indexed_f32f32_f32f32_f32_nchwkcrs_nchw_tilesize128x64x8_stage2_warpsize2x2x1_g1_ffma_aligna4_alignc4_beta0_packed_stride Tactic: 0x31aa67f57c5aea77 Time: 14.1382
[06/23/2025-11:22:35] [V] [TRT] Tactic Name: sm80_xmma_fprop_implicit_gemm_f32f32_f32f32_f32_nchwkcrs_nchw_tilesize64x64x8_stage3_warpsize1x4x1_g1_ffma_aligna4_alignc4 Tactic: 0xa31d27de74b895ff Time: 13.1125
[06/23/2025-11:22:35] [V] [TRT] Tactic Name: sm80_xmma_fprop_implicit_gemm_indexed_f32f32_f32f32_f32_nchwkcrs_nchw_tilesize128x32x8_stage3_warpsize2x2x1_g1_ffma_aligna4_alignc4 Tactic: 0xa9366041633a5135 Time: 17.532
[06/23/2025-11:22:35] [V] [TRT] Tactic Name: sm80_xmma_fprop_implicit_gemm_f32f32_f32f32_f32_nchwkcrs_nchw_tilesize64x128x8_stage3_warpsize1x4x1_g1_ffma_aligna4_alignc4 Tactic: 0x5aa723e0481da855 Time: 11.2656
[06/23/2025-11:22:35] [V] [TRT] Tactic Name: sm80_xmma_fprop_wngd_f32f32_f32_f32_nchwkcrs_nchw_tilesize8x16x32x8_warpsize8x1x1_wngd2x2 Tactic: 0xe47e164f4a743900 Time: 6.46592
[06/23/2025-11:22:35] [V] [TRT] Fast skip Tactic:0x3f243c490d502deb which exceed time limit during pre-run
[06/23/2025-11:22:35] [V] [TRT] Tactic Name: ampere_scudnn_128x64_relu_small_nn_v1 Tactic: 0x3f243c490d502deb Time: 13.0244
[06/23/2025-11:22:35] [V] [TRT] Tactic Name: sm80_xmma_fprop_implicit_gemm_f32f32_f32f32_f32_nchwkcrs_nchw_tilesize64x128x8_stage3_warpsize1x4x1_g1_ffma_t1r3s3_aligna4_alignc4 Tactic: 0x01cf8ce2da913006 Time: 11.3152
[06/23/2025-11:22:35] [V] [TRT] Tactic Name: sm80_xmma_fprop_implicit_gemm_f32f32_f32f32_f32_nchwkcrs_nchw_tilesize128x64x8_stage2_warpsize2x2x1_g1_ffma_t1r3s3_aligna4_alignc4_beta0_packed_stride Tactic: 0x3712e3e595645874 Time: 11.1418
[06/23/2025-11:22:36] [V] [TRT] Fast skip Tactic:0x8ad32616b1424be4 which exceed time limit during pre-run
[06/23/2025-11:22:36] [V] [TRT] Tactic Name: sm80_xmma_fprop_implicit_gemm_f32f32_f32f32_f32_nchwkcrs_nchw_tilesize32x32x8_stage3_warpsize1x2x1_g1_ffma_t1r3s3_aligna4_alignc4 Tactic: 0x8ad32616b1424be4 Time: 13.347
[06/23/2025-11:22:36] [V] [TRT] Tactic Name: sm80_xmma_fprop_implicit_gemm_f32f32_f32f32_f32_nchwkcrs_nchw_tilesize64x64x8_stage3_warpsize1x4x1_g1_ffma_t1r3s3_aligna4_alignc4 Tactic: 0x4727434768e46395 Time: 13.7489
[06/23/2025-11:22:36] [V] [TRT] Tactic Name: sm80_xmma_fprop_implicit_gemm_f32f32_f32f32_f32_nchwkcrs_nchw_tilesize256x128x8_stage3_warpsize4x2x1_g1_ffma_t1r3s3_aligna4_alignc4 Tactic: 0x4efce38acc876f5c Time: 10.332
[06/23/2025-11:22:36] [V] [TRT] Fast skip Tactic:0x1673e3594ce11cea which exceed time limit during pre-run
[06/23/2025-11:22:36] [V] [TRT] Tactic Name: sm80_xmma_fprop_implicit_gemm_indexed_f32f32_f32f32_f32_nchwkcrs_nchw_tilesize128x64x8_stage2_warpsize4x1x1_g1_ffma_aligna4_alignc4_beta0_packed_stride Tactic: 0x1673e3594ce11cea Time: 15.884
[06/23/2025-11:22:36] [V] [TRT] Fast skip Tactic:0x40a12e3938221818 which exceed time limit during pre-run
[06/23/2025-11:22:36] [V] [TRT] Tactic Name: sm80_xmma_fprop_implicit_gemm_indexed_f32f32_f32f32_f32_nchwkcrs_nchw_tilesize128x16x8_stage3_warpsize4x1x1_g1_ffma_aligna4_alignc4 Tactic: 0x40a12e3938221818 Time: 23.2281
[06/23/2025-11:22:36] [V] [TRT] Fast skip Tactic:0xcb8a43f748d8a338 which exceed time limit during pre-run
[06/23/2025-11:22:36] [V] [TRT] Tactic Name: sm80_xmma_fprop_implicit_gemm_indexed_f32f32_f32f32_f32_nchwkcrs_nchw_tilesize32x32x8_stage3_warpsize1x2x1_g1_ffma_aligna4_alignc4 Tactic: 0xcb8a43f748d8a338 Time: 18.7949
[06/23/2025-11:22:36] [V] [TRT] Tactic Name: sm80_xmma_fprop_wngd_f32f32_f32_f32_nchwkcrs_nchw_tilesize8x16x64x8_warpsize8x1x1_wngd2x2 Tactic: 0x0190806602534cfd Time: 6.29192
[06/23/2025-11:22:36] [V] [TRT] Fast skip Tactic:0xede36641840ce3d2 which exceed time limit during pre-run
[06/23/2025-11:22:36] [V] [TRT] Tactic Name: sm80_xmma_fprop_implicit_gemm_indexed_f32f32_f32f32_f32_nchwkcrs_nchw_tilesize128x64x8_stage2_warpsize1x4x1_g1_ffma_aligna4_alignc4_beta0_packed_stride Tactic: 0xede36641840ce3d2 Time: 15.042
[06/23/2025-11:22:36] [V] [TRT] Fast skip Tactic:0x9d9fdb5fd9945f64 which exceed time limit during pre-run
[06/23/2025-11:22:36] [V] [TRT] Tactic Name: sm80_xmma_fprop_implicit_gemm_f32f32_f32f32_f32_nchwkcrs_nchw_tilesize128x16x8_stage3_warpsize4x1x1_g1_ffma_aligna4_alignc4 Tactic: 0x9d9fdb5fd9945f64 Time: 14.3189
[06/23/2025-11:22:36] [V] [TRT] Tactic Name: sm80_xmma_fprop_implicit_gemm_f32f32_f32f32_f32_nchwkcrs_nchw_tilesize256x128x8_stage3_warpsize4x2x1_g1_ffma_aligna4_alignc4 Tactic: 0xbb8c3889c7eacd30 Time: 10.3798
[06/23/2025-11:22:36] [V] [TRT] Tactic Name: sm80_xmma_fprop_implicit_gemm_f32f32_f32f32_f32_nchwkcrs_nchw_tilesize128x64x8_stage2_warpsize1x4x1_g1_ffma_t1r3s3_aligna4_alignc4_beta0_packed_stride Tactic: 0x7fc93550f5b9c127 Time: 12.0682
[06/23/2025-11:22:36] [V] [TRT] Tactic Name: ampere_scudnn_winograd_128x128_ldg1_ldg4_relu_tile148t_nt_v1 Tactic: 0x94119b4c514b211a Time: 5.43286
[06/23/2025-11:22:36] [V] [TRT] Fast skip Tactic:0xd828f024626fa982 which exceed time limit during pre-run
[06/23/2025-11:22:36] [V] [TRT] Tactic Name: sm80_xmma_fprop_implicit_gemm_indexed_f32f32_f32f32_f32_nchwkcrs_nchw_tilesize64x64x8_stage3_warpsize1x4x1_g1_ffma_aligna4_alignc4 Tactic: 0xd828f024626fa982 Time: 16.8571
[06/23/2025-11:22:37] [V] [TRT] Fast skip Tactic:0xe640ceafd7d34ca9 which exceed time limit during pre-run
[06/23/2025-11:22:37] [V] [TRT] Tactic Name: sm80_xmma_fprop_implicit_gemm_f32f32_f32f32_f32_nchwkcrs_nchw_tilesize128x64x8_stage2_warpsize4x1x1_g1_ffma_t1r3s3_aligna4_alignc4_beta0_packed_stride Tactic: 0xe640ceafd7d34ca9 Time: 12.4842
[06/23/2025-11:22:37] [V] [TRT] Fast skip Tactic:0xb0bf940d5e0f9f45 which exceed time limit during pre-run
[06/23/2025-11:22:37] [V] [TRT] Tactic Name: sm80_xmma_fprop_implicit_gemm_f32f32_f32f32_f32_nchwkcrs_nchw_tilesize32x32x8_stage3_warpsize1x2x1_g1_ffma_aligna4_alignc4 Tactic: 0xb0bf940d5e0f9f45 Time: 13.5355
[06/23/2025-11:22:37] [V] [TRT] Tactic Name: ampere_scudnn_128x32_relu_small_nn_v1 Tactic: 0xa8609adc4e0ceb90 Time: 10.6931
[06/23/2025-11:22:37] [V] [TRT] Fast skip Tactic:0x12dbf7d94ee3696d which exceed time limit during pre-run
[06/23/2025-11:22:37] [V] [TRT] Tactic Name: sm80_xmma_fprop_implicit_gemm_f32f32_f32f32_f32_nchwkcrs_nchw_tilesize128x64x8_stage3_warpsize2x2x1_g1_ffma_aligna4_alignc4 Tactic: 0x12dbf7d94ee3696d Time: 12.6007
[06/23/2025-11:22:37] [V] [TRT] Tactic Name: sm80_xmma_fprop_wngd_f32f32_f32_f32_nchwkcrs_nchw_tilesize8x16x16x8_warpsize8x1x1_wngd2x2 Tactic: 0xe38e9dfd56c33779 Time: 5.73125
[06/23/2025-11:22:37] [V] [TRT] Fast skip Tactic:0xf64396b97c889179 which exceed time limit during pre-run
[06/23/2025-11:22:37] [V] [TRT] Tactic Name: ampere_scudnn_128x64_relu_medium_nn_v1 Tactic: 0xf64396b97c889179 Time: 13.2713
[06/23/2025-11:22:37] [V] [TRT] Conv_0 + Relu_1 (CaskConvolution[0x80000009]) profiling completed in 2.77865 seconds. Fastest Tactic: 0x94119b4c514b211a Time: 5.43286
[06/23/2025-11:22:37] [V] [TRT] Skipping CaskFlattenConvolution: No valid tactics for Conv_0 + Relu_1
[06/23/2025-11:22:37] [V] [TRT] >>>>>>>>>>>>>>> Chose Runner Type: CaskConvolution Tactic: 0x94119b4c514b211a
[06/23/2025-11:22:37] [V] [TRT] *************** Autotuning format combination: Float(10368000,1,28800,80) -> Float(10368000,1,28800,80) ***************
[06/23/2025-11:22:37] [V] [TRT] --------------- Timing Runner: Conv_0 + Relu_1 (CaskConvolution[0x80000009])
[06/23/2025-11:22:37] [V] [TRT] Tactic Name: sm80_xmma_fprop_implicit_gemm_f32f32_f32f32_f32_nhwckrsc_nhwc_tilesize64x64x8_stage3_warpsize1x4x1_g1_ffma_t1r3s3_aligna4_alignc4 Tactic: 0x94a7db94ba744c45 Time: 11.727
[06/23/2025-11:22:37] [V] [TRT] Tactic Name: sm80_xmma_fprop_implicit_gemm_f32f32_f32f32_f32_nhwckrsc_nhwc_tilesize128x64x8_stage3_warpsize2x2x1_g1_ffma_t1r3s3_aligna4_alignc4 Tactic: 0xf48db81f02eca9ee Time: 10.9923
[06/23/2025-11:22:37] [V] [TRT] Tactic Name: sm80_xmma_fprop_implicit_gemm_f32f32_f32f32_f32_nhwckrsc_nhwc_tilesize64x256x8_stage3_warpsize1x4x1_g1_ffma_t1r3s3_aligna4_alignc4 Tactic: 0x3f0c846d6379bc98 Time: 19.4027
[06/23/2025-11:22:37] [V] [TRT] Tactic Name: sm80_xmma_fprop_implicit_gemm_indexed_f32f32_f32f32_f32_nhwckrsc_nhwc_tilesize32x32x8_stage3_warpsize1x2x1_g1_ffma_aligna4_alignc4 Tactic: 0x0a143be7a52f301a Time: 14.5104
[06/23/2025-11:22:38] [V] [TRT] Tactic Name: sm80_xmma_fprop_implicit_gemm_f32f32_f32f32_f32_nhwckrsc_nhwc_tilesize64x128x8_stage3_warpsize1x4x1_g1_ffma_t1r3s3_aligna4_alignc4 Tactic: 0xd15dd11d64344e83 Time: 10.7671
[06/23/2025-11:22:38] [V] [TRT] Tactic Name: sm80_xmma_fprop_implicit_gemm_f32f32_f32f32_f32_nhwckrsc_nhwc_tilesize128x64x8_stage3_warpsize2x2x1_g1_ffma_aligna4_alignc4 Tactic: 0x1da91d865428f237 Time: 10.9852
[06/23/2025-11:22:38] [V] [TRT] Tactic Name: sm80_xmma_fprop_implicit_gemm_f32f32_f32f32_f32_nhwckrsc_nhwc_tilesize128x16x8_stage3_warpsize4x1x1_g1_ffma_aligna4_alignc4 Tactic: 0x92ed3100c35fc43e Time: 11.6148
[06/23/2025-11:22:38] [V] [TRT] Tactic Name: sm80_xmma_fprop_implicit_gemm_indexed_f32f32_f32f32_f32_nhwckrsc_nhwc_tilesize128x32x8_stage3_warpsize2x2x1_g1_ffma_aligna4_alignc4 Tactic: 0xa6448a1e79f1ca6f Time: 11.0501
[06/23/2025-11:22:38] [V] [TRT] Tactic Name: sm80_xmma_fprop_implicit_gemm_f32f32_f32f32_f32_nhwckrsc_nhwc_tilesize256x64x8_stage3_warpsize2x2x1_g1_ffma_aligna4_alignc4 Tactic: 0x8014228ec08b4d49 Time: 10.1977
[06/23/2025-11:22:38] [V] [TRT] Tactic Name: sm80_xmma_fprop_implicit_gemm_f32f32_f32f32_f32_nhwckrsc_nhwc_tilesize64x64x8_stage3_warpsize1x4x1_g1_ffma_aligna4_alignc4 Tactic: 0x62835fce994f06dd Time: 11.6298
[06/23/2025-11:22:38] [V] [TRT] Tactic Name: sm80_xmma_fprop_implicit_gemm_indexed_f32f32_f32f32_f32_nhwckrsc_nhwc_tilesize128x16x8_stage3_warpsize4x1x1_g1_ffma_aligna4_alignc4 Tactic: 0x4fd3c46622e98342 Time: 14.0897
[06/23/2025-11:22:38] [V] [TRT] Tactic Name: sm80_xmma_fprop_implicit_gemm_f32f32_f32f32_f32_nhwckrsc_nhwc_tilesize128x16x8_stage3_warpsize4x1x1_g1_ffma_t1r3s3_aligna4_alignc4 Tactic: 0x32059de4888dfdda Time: 11.4418
[06/23/2025-11:22:39] [V] [TRT] Tactic Name: sm80_xmma_fprop_implicit_gemm_indexed_f32f32_f32f32_f32_nhwckrsc_nhwc_tilesize64x64x8_stage3_warpsize1x4x1_g1_ffma_aligna4_alignc4 Tactic: 0x19b688348f983aa0 Time: 13.9766
[06/23/2025-11:22:39] [V] [TRT] Tactic Name: sm80_xmma_fprop_implicit_gemm_f32f32_f32f32_f32_nhwckrsc_nhwc_tilesize32x32x8_stage3_warpsize1x2x1_g1_ffma_t1r3s3_aligna4_alignc4 Tactic: 0x5953bec563d26434 Time: 12.7328
[06/23/2025-11:22:39] [V] [TRT] Tactic Name: sm80_xmma_fprop_implicit_gemm_f32f32_f32f32_f32_nhwckrsc_nhwc_tilesize32x32x8_stage3_warpsize1x2x1_g1_ffma_aligna4_alignc4 Tactic: 0x7121ec1db3f80c67 Time: 12.7257
[06/23/2025-11:22:39] [V] [TRT] Conv_0 + Relu_1 (CaskConvolution[0x80000009]) profiling completed in 2.06247 seconds. Fastest Tactic: 0x8014228ec08b4d49 Time: 10.1977
[06/23/2025-11:22:39] [V] [TRT] Skipping CaskFlattenConvolution: No valid tactics for Conv_0 + Relu_1
[06/23/2025-11:22:39] [V] [TRT] >>>>>>>>>>>>>>> Chose Runner Type: CaskConvolution Tactic: 0x8014228ec08b4d49
[06/23/2025-11:22:39] [V] [TRT] *************** Autotuning format combination: Float(2592000,1:4,7200,20) -> Float(10368000,129600,360,1) ***************
[06/23/2025-11:22:39] [V] [TRT] --------------- Timing Runner: Conv_0 + Relu_1 (CaskConvolution[0x80000009])
[06/23/2025-11:22:39] [V] [TRT] Tactic Name: sm80_xmma_fprop_implicit_gemm_f32f32_tf32f32_f32_nhwckrsc_nchw_tilesize128x128x32_stage4_warpsize2x2x1_g1_tensor16x8x8_t1r3s3 Tactic: 0xd7390b594d1ce947 Time: 3.01562
[06/23/2025-11:22:39] [V] [TRT] Tactic Name: sm80_xmma_fprop_implicit_gemm_indexed_f32f32_tf32f32_f32_nhwckrsc_nchw_tilesize128x256x32_stage3_warpsize2x4x1_g1_tensor16x8x8 Tactic: 0xcd6c525a3239bae9 Time: 5.59833
[06/23/2025-11:22:39] [V] [TRT] Fast skip Tactic:0xd106f5c552452296 which exceed time limit during pre-run
[06/23/2025-11:22:39] [V] [TRT] Tactic Name: sm80_xmma_fprop_implicit_gemm_f32f32_tf32f32_f32_nhwckrsc_nchw_tilesize64x32x64_stage5_warpsize2x2x1_g1_tensor16x8x8_t1r3s3_alignc4 Tactic: 0xd106f5c552452296 Time: 7.91094
[06/23/2025-11:22:39] [V] [TRT] Tactic Name: sm80_xmma_fprop_implicit_gemm_f32f32_tf32f32_f32_nhwckrsc_nchw_tilesize128x64x32_stage5_warpsize2x2x1_g1_tensor16x8x8_alignc4 Tactic: 0x294c501bad19317c Time: 4.53421
[06/23/2025-11:22:39] [V] [TRT] Tactic Name: sm80_xmma_fprop_implicit_gemm_f32f32_tf32f32_f32_nhwckrsc_nchw_tilesize128x64x64_stage3_warpsize2x2x1_g1_tensor16x8x8_t1r3s3_alignc4 Tactic: 0x14ce6e2746cfbad7 Time: 5.50367
[06/23/2025-11:22:39] [V] [TRT] Tactic Name: sm80_xmma_fprop_implicit_gemm_f32f32_tf32f32_f32_nhwckrsc_nchw_tilesize128x128x16_stage4_warpsize2x2x1_g1_tensor16x8x8_t1r3s3_alignc4 Tactic: 0x1323e48791e2f671 Time: 2.56764
[06/23/2025-11:22:39] [V] [TRT] Tactic Name: sm80_xmma_fprop_implicit_gemm_f32f32_tf32f32_f32_nhwckrsc_nchw_tilesize128x128x16_stage4_warpsize2x2x1_g1_tensor16x8x8_alignc4 Tactic: 0x9fd9fe001908ce2e Time: 2.65427
[06/23/2025-11:22:39] [V] [TRT] Tactic Name: sm80_xmma_fprop_implicit_gemm_f32f32_tf32f32_f32_nhwckrsc_nchw_tilesize128x128x32_stage4_warpsize2x2x1_g1_tensor16x8x8_t1r3s3_alignc4 Tactic: 0xc50ec1760635de6f Time: 3.03657
[06/23/2025-11:22:39] [V] [TRT] Fast skip Tactic:0xf5c5ffdea9383daa which exceed time limit during pre-run
[06/23/2025-11:22:39] [V] [TRT] Tactic Name: sm80_xmma_fprop_implicit_gemm_f32f32_tf32f32_f32_nhwckrsc_nchw_tilesize64x32x64_stage5_warpsize2x2x1_g1_tensor16x8x8_t1r3s3 Tactic: 0xf5c5ffdea9383daa Time: 7.88762
[06/23/2025-11:22:39] [V] [TRT] Fast skip Tactic:0xbfdf05725bf3ea6d which exceed time limit during pre-run
[06/23/2025-11:22:39] [V] [TRT] Tactic Name: sm80_xmma_fprop_implicit_gemm_f32f32_tf32f32_f32_nhwckrsc_nchw_tilesize64x64x64_stage4_warpsize2x2x1_g1_tensor16x8x8_t1r3s3 Tactic: 0xbfdf05725bf3ea6d Time: 7.00266
[06/23/2025-11:22:39] [V] [TRT] Tactic Name: sm80_xmma_fprop_implicit_gemm_f32f32_tf32f32_f32_nhwckrsc_nchw_tilesize128x64x32_stage5_warpsize2x2x1_g1_tensor16x8x8 Tactic: 0xa95e2a26416587cd Time: 4.23756
[06/23/2025-11:22:39] [V] [TRT] Tactic Name: sm80_xmma_fprop_implicit_gemm_f32f32_tf32f32_f32_nhwckrsc_nchw_tilesize256x128x32_stage3_warpsize4x2x1_g1_tensor16x8x8_t1r3s3 Tactic: 0x2f3dd4e092216107 Time: 2.85632
[06/23/2025-11:22:40] [V] [TRT] Tactic Name: sm80_xmma_fprop_implicit_gemm_indexed_f32f32_tf32f32_f32_nhwckrsc_nchw_tilesize128x128x16_stage4_warpsize2x2x1_g1_tensor16x8x8_alignc4 Tactic: 0xe8f7b6a5bab325f8 Time: 2.8106
[06/23/2025-11:22:40] [V] [TRT] Fast skip Tactic:0xbf7080aca6804022 which exceed time limit during pre-run
[06/23/2025-11:22:40] [V] [TRT] Tactic Name: sm80_xmma_fprop_implicit_gemm_indexed_f32f32_tf32f32_f32_nhwckrsc_nchw_tilesize128x256x32_stage3_warpsize2x4x1_g1_tensor16x8x8_alignc4 Tactic: 0xbf7080aca6804022 Time: 5.60035
[06/23/2025-11:22:40] [V] [TRT] Tactic Name: sm80_xmma_fprop_implicit_gemm_f32f32_tf32f32_f32_nhwckrsc_nchw_tilesize64x128x32_stage5_warpsize2x2x1_g1_tensor16x8x8_t1r3s3 Tactic: 0xec566784128c4eda Time: 4.25082
[06/23/2025-11:22:40] [V] [TRT] Tactic Name: sm80_xmma_fprop_implicit_gemm_indexed_f32f32_tf32f32_f32_nhwckrsc_nchw_tilesize128x128x16_stage4_warpsize2x2x1_g1_tensor16x8x8 Tactic: 0xe0a307ffe0ffb6a5 Time: 2.78517
[06/23/2025-11:22:40] [V] [TRT] Tactic Name: sm80_xmma_fprop_implicit_gemm_indexed_f32f32_tf32f32_f32_nhwckrsc_nchw_tilesize256x64x32_stage3_warpsize4x2x1_g1_tensor16x8x8 Tactic: 0x7449ed93fb7feabf Time: 3.92455
[06/23/2025-11:22:40] [V] [TRT] Tactic Name: sm80_xmma_fprop_implicit_gemm_f32f32_tf32f32_f32_nhwckrsc_nchw_tilesize128x128x32_stage4_warpsize2x2x1_g1_tensor16x8x8 Tactic: 0xa0f5a3abd9b9c82a Time: 3.03432
[06/23/2025-11:22:40] [V] [TRT] Tactic Name: sm80_xmma_fprop_implicit_gemm_f32f32_tf32f32_f32_nhwckrsc_nchw_tilesize256x64x32_stage3_warpsize4x2x1_g1_tensor16x8x8 Tactic: 0x009385d9017d87ea Time: 3.62226
[06/23/2025-11:22:40] [V] [TRT] Tactic Name: sm80_xmma_fprop_implicit_gemm_f32f32_tf32f32_f32_nhwckrsc_nchw_tilesize64x128x32_stage5_warpsize2x2x1_g1_tensor16x8x8 Tactic: 0xabbf7eb3b5b99502 Time: 4.21519
[06/23/2025-11:22:40] [V] [TRT] Fast skip Tactic:0x6f57319253e043c7 which exceed time limit during pre-run
[06/23/2025-11:22:40] [V] [TRT] Tactic Name: sm80_xmma_fprop_implicit_gemm_f32f32_tf32f32_f32_nhwckrsc_nchw_tilesize128x256x32_stage3_warpsize2x4x1_g1_tensor16x8x8_t1r3s3 Tactic: 0x6f57319253e043c7 Time: 5.39837
[06/23/2025-11:22:40] [V] [TRT] Tactic Name: sm80_xmma_fprop_implicit_gemm_f32f32_tf32f32_f32_nhwckrsc_nchw_tilesize128x64x32_stage5_warpsize2x2x1_g1_tensor16x8x8_t1r3s3_alignc4 Tactic: 0x2bf0858f240ff918 Time: 4.37051
[06/23/2025-11:22:40] [V] [TRT] Tactic Name: sm80_xmma_fprop_implicit_gemm_f32f32_tf32f32_f32_nhwckrsc_nchw_tilesize64x128x32_stage5_warpsize2x2x1_g1_tensor16x8x8_alignc4 Tactic: 0x8a196054417f1c8a Time: 4.71265
[06/23/2025-11:22:40] [V] [TRT] Tactic Name: sm80_xmma_fprop_implicit_gemm_indexed_f32f32_tf32f32_f32_nhwckrsc_nchw_tilesize128x64x32_stage5_warpsize2x2x1_g1_tensor16x8x8 Tactic: 0xdd84426cbb67ea98 Time: 4.7353
[06/23/2025-11:22:40] [V] [TRT] Tactic Name: sm80_xmma_fprop_implicit_gemm_f32f32_tf32f32_f32_nhwckrsc_nchw_tilesize128x64x32_stage5_warpsize2x2x1_g1_tensor16x8x8_t1r3s3 Tactic: 0x42b6ff75b94b8cbd Time: 4.30412
[06/23/2025-11:22:40] [V] [TRT] Tactic Name: sm80_xmma_fprop_implicit_gemm_f32f32_tf32f32_f32_nhwckrsc_nchw_tilesize256x128x32_stage3_warpsize4x2x1_g1_tensor16x8x8 Tactic: 0x62d0fae781700403 Time: 2.88318
[06/23/2025-11:22:40] [V] [TRT] Fast skip Tactic:0x7c012183b88ca724 which exceed time limit during pre-run
[06/23/2025-11:22:40] [V] [TRT] Tactic Name: sm80_xmma_fprop_implicit_gemm_f32f32_tf32f32_f32_nhwckrsc_nchw_tilesize64x64x64_stage4_warpsize2x2x1_g1_tensor16x8x8 Tactic: 0x7c012183b88ca724 Time: 7.25066
[06/23/2025-11:22:40] [V] [TRT] Tactic Name: sm80_xmma_fprop_implicit_gemm_f32f32_tf32f32_f32_nhwckrsc_nchw_tilesize128x128x32_stage4_warpsize2x2x1_g1_tensor16x8x8_alignc4 Tactic: 0x018af1a619a2581c Time: 3.19759
[06/23/2025-11:22:40] [V] [TRT] Tactic Name: sm80_xmma_fprop_implicit_gemm_f32f32_tf32f32_f32_nhwckrsc_nchw_tilesize64x128x32_stage5_warpsize2x2x1_g1_tensor16x8x8_t1r3s3_alignc4 Tactic: 0x324c63b421c25d95 Time: 4.51186
[06/23/2025-11:22:40] [V] [TRT] Fast skip Tactic:0xc5dec88c13d30802 which exceed time limit during pre-run
[06/23/2025-11:22:40] [V] [TRT] Tactic Name: sm80_xmma_fprop_implicit_gemm_indexed_f32f32_tf32f32_f32_nhwckrsc_nchw_tilesize64x64x64_stage4_warpsize2x2x1_g1_tensor16x8x8 Tactic: 0xc5dec88c13d30802 Time: 8.08915
[06/23/2025-11:22:40] [V] [TRT] Fast skip Tactic:0xf00aea93dd9c2661 which exceed time limit during pre-run
[06/23/2025-11:22:40] [V] [TRT] Tactic Name: sm80_xmma_fprop_implicit_gemm_indexed_f32f32_tf32f32_f32_nhwckrsc_nchw_tilesize128x64x64_stage3_warpsize2x2x1_g1_tensor16x8x8_alignc4 Tactic: 0xf00aea93dd9c2661 Time: 5.97232
[06/23/2025-11:22:40] [V] [TRT] Fast skip Tactic:0x2a70e740f46257d6 which exceed time limit during pre-run
[06/23/2025-11:22:40] [V] [TRT] Tactic Name: sm80_xmma_fprop_implicit_gemm_indexed_f32f32_tf32f32_f32_nhwckrsc_nchw_tilesize64x32x64_stage5_warpsize2x2x1_g1_tensor16x8x8 Tactic: 0x2a70e740f46257d6 Time: 9.44208
[06/23/2025-11:22:40] [V] [TRT] Fast skip Tactic:0xc85ec809053babf4 which exceed time limit during pre-run
[06/23/2025-11:22:40] [V] [TRT] Tactic Name: sm80_xmma_fprop_implicit_gemm_f32f32_tf32f32_f32_nhwckrsc_nchw_tilesize128x256x32_stage3_warpsize2x4x1_g1_tensor16x8x8_alignc4 Tactic: 0xc85ec809053babf4 Time: 5.62966
[06/23/2025-11:22:40] [V] [TRT] Tactic Name: sm80_xmma_fprop_implicit_gemm_indexed_f32f32_tf32f32_f32_nhwckrsc_nchw_tilesize64x128x32_stage5_warpsize2x2x1_g1_tensor16x8x8 Tactic: 0xdf6516f94fbbf857 Time: 4.61836
[06/23/2025-11:22:41] [V] [TRT] Tactic Name: sm80_xmma_fprop_implicit_gemm_f32f32_tf32f32_f32_nhwckrsc_nchw_tilesize128x128x16_stage4_warpsize2x2x1_g1_tensor16x8x8_t1r3s3 Tactic: 0x9787b83bedcff6a2 Time: 2.66833
[06/23/2025-11:22:41] [V] [TRT] Fast skip Tactic:0x0184e974dcc2b593 which exceed time limit during pre-run
[06/23/2025-11:22:41] [V] [TRT] Tactic Name: sm80_xmma_fprop_implicit_gemm_f32f32_tf32f32_f32_nhwckrsc_nchw_tilesize64x64x64_stage4_warpsize2x2x1_g1_tensor16x8x8_t1r3s3_alignc4 Tactic: 0x0184e974dcc2b593 Time: 7.06832
[06/23/2025-11:22:41] [V] [TRT] Fast skip Tactic:0x06ac89b47db4fceb which exceed time limit during pre-run
[06/23/2025-11:22:41] [V] [TRT] Tactic Name: sm80_xmma_fprop_implicit_gemm_indexed_f32f32_tf32f32_f32_nhwckrsc_nchw_tilesize64x32x64_stage5_warpsize2x2x1_g1_tensor16x8x8_alignc4 Tactic: 0x06ac89b47db4fceb Time: 9.35549
[06/23/2025-11:22:41] [V] [TRT] Tactic Name: sm80_xmma_fprop_implicit_gemm_f32f32_tf32f32_f32_nhwckrsc_nchw_tilesize128x128x16_stage4_warpsize2x2x1_g1_tensor16x8x8 Tactic: 0x3104d85fecdd547c Time: 2.63668
[06/23/2025-11:22:41] [V] [TRT] Tactic Name: sm80_xmma_fprop_implicit_gemm_indexed_f32f32_tf32f32_f32_nhwckrsc_nchw_tilesize64x128x32_stage5_warpsize2x2x1_g1_tensor16x8x8_alignc4 Tactic: 0xe25738550dba0da6 Time: 4.85566
[06/23/2025-11:22:41] [V] [TRT] Fast skip Tactic:0x58d98689a7f663f8 which exceed time limit during pre-run
[06/23/2025-11:22:41] [V] [TRT] Tactic Name: sm80_xmma_fprop_implicit_gemm_f32f32_tf32f32_f32_nhwckrsc_nchw_tilesize128x256x32_stage3_warpsize2x4x1_g1_tensor16x8x8_t1r3s3_alignc4 Tactic: 0x58d98689a7f663f8 Time: 5.44122
[06/23/2025-11:22:41] [V] [TRT] Fast skip Tactic:0x681a3b4e03528583 which exceed time limit during pre-run
[06/23/2025-11:22:41] [V] [TRT] Tactic Name: sm80_xmma_fprop_implicit_gemm_f32f32_tf32f32_f32_nhwckrsc_nchw_tilesize64x32x64_stage5_warpsize2x2x1_g1_tensor16x8x8_alignc4 Tactic: 0x681a3b4e03528583 Time: 8.39683
[06/23/2025-11:22:41] [V] [TRT] Tactic Name: sm80_xmma_fprop_implicit_gemm_f32f32_tf32f32_f32_nhwckrsc_nchw_tilesize256x64x32_stage3_warpsize4x2x1_g1_tensor16x8x8_alignc4 Tactic: 0xdb50068f2f28400e Time: 3.74923
[06/23/2025-11:22:41] [V] [TRT] Fast skip Tactic:0x93af0e4f5f3df8f0 which exceed time limit during pre-run
[06/23/2025-11:22:41] [V] [TRT] Tactic Name: sm80_xmma_fprop_implicit_gemm_f32f32_tf32f32_f32_nhwckrsc_nchw_tilesize64x32x64_stage5_warpsize2x2x1_g1_tensor16x8x8 Tactic: 0x93af0e4f5f3df8f0 Time: 8.20803
[06/23/2025-11:22:41] [V] [TRT] Fast skip Tactic:0x0eef7d6cf0568181 which exceed time limit during pre-run
[06/23/2025-11:22:41] [V] [TRT] Tactic Name: sm80_xmma_fprop_implicit_gemm_f32f32_tf32f32_f32_nhwckrsc_nchw_tilesize128x64x64_stage3_warpsize2x2x1_g1_tensor16x8x8 Tactic: 0x0eef7d6cf0568181 Time: 5.62234
[06/23/2025-11:22:41] [V] [TRT] Tactic Name: sm80_xmma_fprop_implicit_gemm_f32f32_tf32f32_f32_nhwckrsc_nchw_tilesize256x128x32_stage3_warpsize4x2x1_g1_tensor16x8x8_t1r3s3_alignc4 Tactic: 0x5949792953380d23 Time: 2.81095
[06/23/2025-11:22:41] [V] [TRT] Tactic Name: sm80_xmma_fprop_implicit_gemm_f32f32_tf32f32_f32_nhwckrsc_nchw_tilesize256x64x32_stage3_warpsize4x2x1_g1_tensor16x8x8_t1r3s3 Tactic: 0x91b480f174a2dfab Time: 3.71102
[06/23/2025-11:22:41] [V] [TRT] Fast skip Tactic:0x1ccb8dfa3e1b5830 which exceed time limit during pre-run
[06/23/2025-11:22:41] [V] [TRT] Tactic Name: sm80_xmma_fprop_implicit_gemm_f32f32_tf32f32_f32_nhwckrsc_nchw_tilesize128x256x32_stage3_warpsize2x4x1_g1_tensor16x8x8 Tactic: 0x1ccb8dfa3e1b5830 Time: 5.44861
[06/23/2025-11:22:41] [V] [TRT] Fast skip Tactic:0x9746567cb96a1ed8 which exceed time limit during pre-run
[06/23/2025-11:22:41] [V] [TRT] Tactic Name: sm80_xmma_fprop_implicit_gemm_indexed_f32f32_tf32f32_f32_nhwckrsc_nchw_tilesize64x64x64_stage4_warpsize2x2x1_g1_tensor16x8x8_alignc4 Tactic: 0x9746567cb96a1ed8 Time: 8.06474
[06/23/2025-11:22:41] [V] [TRT] Tactic Name: sm80_xmma_fprop_implicit_gemm_f32f32_tf32f32_f32_nhwckrsc_nchw_tilesize256x64x32_stage3_warpsize4x2x1_g1_tensor16x8x8_t1r3s3_alignc4 Tactic: 0xe827e2035205730f Time: 3.57964
[06/23/2025-11:22:41] [V] [TRT] Fast skip Tactic:0xf9f0e486c78c67b0 which exceed time limit during pre-run
[06/23/2025-11:22:41] [V] [TRT] Tactic Name: sm80_xmma_fprop_implicit_gemm_f32f32_tf32f32_f32_nhwckrsc_nchw_tilesize64x64x64_stage4_warpsize2x2x1_g1_tensor16x8x8_alignc4 Tactic: 0xf9f0e486c78c67b0 Time: 7.44915
[06/23/2025-11:22:41] [V] [TRT] Conv_0 + Relu_1 (CaskConvolution[0x80000009]) profiling completed in 2.13094 seconds. Fastest Tactic: 0x1323e48791e2f671 Time: 2.56764
[06/23/2025-11:22:41] [V] [TRT] Skipping CaskFlattenConvolution: No valid tactics for Conv_0 + Relu_1
[06/23/2025-11:22:41] [V] [TRT] >>>>>>>>>>>>>>> Chose Runner Type: CaskConvolution Tactic: 0x1323e48791e2f671
[06/23/2025-11:22:41] [V] [TRT] *************** Autotuning format combination: Float(2592000,1:4,7200,20) -> Float(2592000,1:4,7200,20) ***************
[06/23/2025-11:22:41] [V] [TRT] --------------- Timing Runner: Conv_0 + Relu_1 (CaskConvolution[0x80000009])
[06/23/2025-11:22:41] [V] [TRT] Tactic Name: ampere_scudnn_128x32_sliced1x4_ldg4_relu_exp_small_nhwc_tn_v1 Tactic: 0x3e2b881168d9689d Time: 12.1764
[06/23/2025-11:22:41] [V] [TRT] Tactic Name: ampere_scudnn_128x128_ldg4_relu_exp_medium_nhwc_tn_v1 Tactic: 0x7bc32c782b800c48 Time: 11.2568
[06/23/2025-11:22:41] [V] [TRT] Tactic Name: ampere_scudnn_128x128_ldg4_relu_exp_small_nhwc_tn_v1 Tactic: 0xf90060ce8193b811 Time: 11.2597
[06/23/2025-11:22:42] [V] [TRT] Tactic Name: ampere_scudnn_128x64_sliced1x2_ldg4_relu_exp_large_nhwc_tn_v1 Tactic: 0xbdfdef6b84f7ccc9 Time: 12.8152
[06/23/2025-11:22:42] [V] [TRT] Tactic Name: sm80_xmma_fprop_implicit_gemm_f32f32_tf32f32_f32_nhwckrsc_nhwc_tilesize64x128x32_stage5_warpsize2x2x1_g1_tensor16x8x8 Tactic: 0x65f71607d20d5438 Time: 5.01642
[06/23/2025-11:22:42] [V] [TRT] Tactic Name: sm80_xmma_fprop_implicit_gemm_f32f32_tf32f32_f32_nhwckrsc_nhwc_tilesize128x128x16_stage4_warpsize2x2x1_g1_tensor16x8x8 Tactic: 0xb443c221fcb1565b Time: 2.61237
[06/23/2025-11:22:42] [V] [TRT] Tactic Name: sm80_xmma_fprop_implicit_gemm_f32f32_tf32f32_f32_nhwckrsc_nhwc_tilesize128x128x32_stage4_warpsize2x2x1_g1_tensor16x8x8 Tactic: 0x25b2b9d5c9d5ca0d Time: 3.03941
[06/23/2025-11:22:42] [V] [TRT] Tactic Name: sm80_xmma_fprop_implicit_gemm_f32f32_tf32f32_f32_nhwckrsc_nhwc_tilesize256x64x32_stage3_warpsize4x2x1_g1_tensor16x8x8_t1r3s3 Tactic: 0xa9a06d0633580c0c Time: 3.45493
[06/23/2025-11:22:42] [V] [TRT] Fast skip Tactic:0x2d80d2b384ab13f1 which exceed time limit during pre-run
[06/23/2025-11:22:42] [V] [TRT] Tactic Name: sm80_xmma_fprop_implicit_gemm_f32f32_tf32f32_f32_nhwckrsc_nhwc_tilesize64x64x64_stage4_warpsize2x2x1_g1_tensor16x8x8_t1r3s3 Tactic: 0x2d80d2b384ab13f1 Time: 6.86326
[06/23/2025-11:22:42] [V] [TRT] Fast skip Tactic:0xd7f5d575d49a4bc7 which exceed time limit during pre-run
[06/23/2025-11:22:42] [V] [TRT] Tactic Name: sm80_xmma_fprop_implicit_gemm_indexed_f32f32_tf32f32_f32_nhwckrsc_nhwc_tilesize64x32x64_stage5_warpsize2x2x1_g1_tensor16x8x8 Tactic: 0xd7f5d575d49a4bc7 Time: 9.33574
[06/23/2025-11:22:42] [V] [TRT] Fast skip Tactic:0x482b48242255b8ce which exceed time limit during pre-run
[06/23/2025-11:22:42] [V] [TRT] Tactic Name: sm80_xmma_fprop_implicit_gemm_indexed_f32f32_tf32f32_f32_nhwckrsc_nhwc_tilesize128x256x32_stage3_warpsize2x4x1_g1_tensor16x8x8 Tactic: 0x482b48242255b8ce Time: 5.4193
[06/23/2025-11:22:42] [V] [TRT] Tactic Name: sm80_xmma_fprop_implicit_gemm_indexed_f32f32_tf32f32_f32_nhwckrsc_nhwc_tilesize256x64x32_stage3_warpsize4x2x1_g1_tensor16x8x8 Tactic: 0xba0185279ccb2b85 Time: 3.93819
[06/23/2025-11:22:42] [V] [TRT] Tactic Name: sm80_xmma_fprop_implicit_gemm_f32f32_tf32f32_f32_nhwckrsc_nhwc_tilesize256x128x32_stage3_warpsize4x2x1_g1_tensor16x8x8_t1r3s3 Tactic: 0x21246c8544eff903 Time: 2.66948
[06/23/2025-11:22:42] [V] [TRT] Fast skip Tactic:0x385bfab9332b1413 which exceed time limit during pre-run
[06/23/2025-11:22:42] [V] [TRT] Tactic Name: sm80_xmma_fprop_implicit_gemm_indexed_f32f32_tf32f32_f32_nhwckrsc_nhwc_tilesize64x64x64_stage4_warpsize2x2x1_g1_tensor16x8x8 Tactic: 0x385bfab9332b1413 Time: 7.96006
[06/23/2025-11:22:42] [V] [TRT] Tactic Name: sm80_xmma_fprop_implicit_gemm_indexed_f32f32_tf32f32_f32_nhwckrsc_nhwc_tilesize128x128x16_stage4_warpsize2x2x1_g1_tensor16x8x8 Tactic: 0x65e41d81f093b482 Time: 2.74207
[06/23/2025-11:22:42] [V] [TRT] Tactic Name: sm80_xmma_fprop_implicit_gemm_f32f32_tf32f32_f32_nhwckrsc_nhwc_tilesize128x64x32_stage5_warpsize2x2x1_g1_tensor16x8x8_t1r3s3 Tactic: 0x7aa21282feb15f1a Time: 4.09883
[06/23/2025-11:22:42] [V] [TRT] Fast skip Tactic:0xc0a715d897e240bb which exceed time limit during pre-run
[06/23/2025-11:22:42] [V] [TRT] Tactic Name: sm80_xmma_fprop_implicit_gemm_f32f32_tf32f32_f32_nhwckrsc_nhwc_tilesize128x64x64_stage3_warpsize2x2x1_g1_tensor16x8x8 Tactic: 0xc0a715d897e240bb Time: 5.67203
[06/23/2025-11:22:42] [V] [TRT] Tactic Name: sm80_xmma_fprop_implicit_gemm_f32f32_tf32f32_f32_nhwckrsc_nhwc_tilesize128x128x16_stage4_warpsize2x2x1_g1_tensor16x8x8_t1r3s3 Tactic: 0x999e005e3b016ea6 Time: 2.46843
[06/23/2025-11:22:42] [V] [TRT] Fast skip Tactic:0x614e89f7852edbc3 which exceed time limit during pre-run
[06/23/2025-11:22:42] [V] [TRT] Tactic Name: sm80_xmma_fprop_implicit_gemm_f32f32_tf32f32_f32_nhwckrsc_nhwc_tilesize128x256x32_stage3_warpsize2x4x1_g1_tensor16x8x8_t1r3s3 Tactic: 0x614e89f7852edbc3 Time: 5.22291
[06/23/2025-11:22:42] [V] [TRT] Tactic Name: sm80_xmma_fprop_implicit_gemm_f32f32_tf32f32_f32_nhwckrsc_nhwc_tilesize128x128x32_stage4_warpsize2x2x1_g1_tensor16x8x8_t1r3s3 Tactic: 0xd920b33c9bd27143 Time: 2.89727
[06/23/2025-11:22:42] [V] [TRT] Tactic Name: sm80_xmma_fprop_implicit_gemm_f32f32_tf32f32_f32_nhwckrsc_nhwc_tilesize128x64x32_stage5_warpsize2x2x1_g1_tensor16x8x8 Tactic: 0x6716429226d146f7 Time: 4.32179
[06/23/2025-11:22:42] [V] [TRT] Fast skip Tactic:0x679a281f7660c436 which exceed time limit during pre-run
[06/23/2025-11:22:42] [V] [TRT] Tactic Name: sm80_xmma_fprop_implicit_gemm_f32f32_tf32f32_f32_nhwckrsc_nhwc_tilesize64x32x64_stage5_warpsize2x2x1_g1_tensor16x8x8_t1r3s3 Tactic: 0x679a281f7660c436 Time: 8.08429
[06/23/2025-11:22:42] [V] [TRT] Fast skip Tactic:0xeb65d4c1e8fa2294 which exceed time limit during pre-run
[06/23/2025-11:22:42] [V] [TRT] Tactic Name: sm80_xmma_fprop_implicit_gemm_f32f32_tf32f32_f32_nhwckrsc_nhwc_tilesize128x64x64_stage3_warpsize2x2x1_g1_tensor16x8x8_t1r3s3 Tactic: 0xeb65d4c1e8fa2294 Time: 5.28554
[06/23/2025-11:22:42] [V] [TRT] Tactic Name: sm80_xmma_fprop_implicit_gemm_indexed_f32f32_tf32f32_f32_nhwckrsc_nhwc_tilesize128x128x32_stage4_warpsize2x2x1_g1_tensor16x8x8 Tactic: 0xf4156675c5f728d4 Time: 4.56725
[06/23/2025-11:22:42] [V] [TRT] Tactic Name: sm80_xmma_fprop_implicit_gemm_indexed_f32f32_tf32f32_f32_nhwckrsc_nhwc_tilesize64x128x32_stage5_warpsize2x2x1_g1_tensor16x8x8 Tactic: 0x112d7e4d280f396d Time: 4.51252
[06/23/2025-11:22:43] [V] [TRT] Fast skip Tactic:0x6e2a3c7a7fc5e4e1 which exceed time limit during pre-run
[06/23/2025-11:22:43] [V] [TRT] Tactic Name: sm80_xmma_fprop_implicit_gemm_f32f32_tf32f32_f32_nhwckrsc_nhwc_tilesize64x32x64_stage5_warpsize2x2x1_g1_tensor16x8x8 Tactic: 0x6e2a3c7a7fc5e4e1 Time: 8.48934
[06/23/2025-11:22:43] [V] [TRT] Tactic Name: sm80_xmma_fprop_implicit_gemm_indexed_f32f32_tf32f32_f32_nhwckrsc_nhwc_tilesize128x64x32_stage5_warpsize2x2x1_g1_tensor16x8x8 Tactic: 0x13cc2ad8dcd32ba2 Time: 4.93363
[06/23/2025-11:22:43] [V] [TRT] Tactic Name: sm80_xmma_fprop_implicit_gemm_f32f32_tf32f32_f32_nhwckrsc_nhwc_tilesize256x128x32_stage3_warpsize4x2x1_g1_tensor16x8x8 Tactic: 0xe797e099911c0624 Time: 2.79884
[06/23/2025-11:22:43] [V] [TRT] Tactic Name: sm80_xmma_fprop_implicit_gemm_indexed_f32f32_tf32f32_f32_nhwckrsc_nhwc_tilesize256x128x32_stage3_warpsize4x2x1_g1_tensor16x8x8 Tactic: 0x36303f399d3ee4fd Time: 3.31894
[06/23/2025-11:22:43] [V] [TRT] Tactic Name: sm80_xmma_fprop_implicit_gemm_f32f32_tf32f32_f32_nhwckrsc_nhwc_tilesize64x128x32_stage5_warpsize2x2x1_g1_tensor16x8x8_t1r3s3 Tactic: 0xd4428a7355769d7d Time: 3.93266
[06/23/2025-11:22:43] [V] [TRT] Fast skip Tactic:0xb47d7d926de02dee which exceed time limit during pre-run
[06/23/2025-11:22:43] [V] [TRT] Tactic Name: sm80_xmma_fprop_implicit_gemm_indexed_f32f32_tf32f32_f32_nhwckrsc_nhwc_tilesize128x64x64_stage3_warpsize2x2x1_g1_tensor16x8x8 Tactic: 0xb47d7d926de02dee Time: 5.88125
[06/23/2025-11:22:43] [V] [TRT] Fast skip Tactic:0x818413b69874bb35 which exceed time limit during pre-run
[06/23/2025-11:22:43] [V] [TRT] Tactic Name: sm80_xmma_fprop_implicit_gemm_f32f32_tf32f32_f32_nhwckrsc_nhwc_tilesize64x64x64_stage4_warpsize2x2x1_g1_tensor16x8x8 Tactic: 0x818413b69874bb35 Time: 7.21987
[06/23/2025-11:22:43] [V] [TRT] Fast skip Tactic:0x998c97842e775a17 which exceed time limit during pre-run
[06/23/2025-11:22:43] [V] [TRT] Tactic Name: sm80_xmma_fprop_implicit_gemm_f32f32_tf32f32_f32_nhwckrsc_nhwc_tilesize128x256x32_stage3_warpsize2x4x1_g1_tensor16x8x8 Tactic: 0x998c97842e775a17 Time: 5.44272
[06/23/2025-11:22:43] [V] [TRT] Tactic Name: sm80_xmma_fprop_implicit_gemm_f32f32_tf32f32_f32_nhwckrsc_nhwc_tilesize256x64x32_stage3_warpsize4x2x1_g1_tensor16x8x8 Tactic: 0xcedbed6d66c946d0 Time: 3.61238
[06/23/2025-11:22:43] [V] [TRT] Conv_0 + Relu_1 (CaskConvolution[0x80000009]) profiling completed in 1.75777 seconds. Fastest Tactic: 0x999e005e3b016ea6 Time: 2.46843
[06/23/2025-11:22:43] [V] [TRT] Skipping CaskFlattenConvolution: No valid tactics for Conv_0 + Relu_1
[06/23/2025-11:22:43] [V] [TRT] >>>>>>>>>>>>>>> Chose Runner Type: CaskConvolution Tactic: 0x999e005e3b016ea6
[06/23/2025-11:22:43] [V] [TRT] *************** Autotuning format combination: Half(10368000,129600,360,1) -> Half(10368000,129600,360,1) ***************
[06/23/2025-11:22:43] [V] [TRT] Skipping CaskConvolution: No valid tactics for Conv_0 + Relu_1
[06/23/2025-11:22:43] [V] [TRT] Skipping CaskFlattenConvolution: No valid tactics for Conv_0 + Relu_1
[06/23/2025-11:22:43] [V] [TRT] *************** Autotuning format combination: Half(5184000,1:2,14400,40) -> Half(5184000,1:2,14400,40) ***************
[06/23/2025-11:22:43] [V] [TRT] Skipping CaskConvolution: No valid tactics for Conv_0 + Relu_1
[06/23/2025-11:22:43] [V] [TRT] Skipping CaskFlattenConvolution: No valid tactics for Conv_0 + Relu_1
[06/23/2025-11:22:43] [V] [TRT] *************** Autotuning format combination: Half(2592000,1:4,7200,20) -> Half(2592000,1:4,7200,20) ***************
[06/23/2025-11:22:43] [V] [TRT] Skipping CaskConvolution: No valid tactics for Conv_0 + Relu_1
[06/23/2025-11:22:43] [V] [TRT] Skipping CaskFlattenConvolution: No valid tactics for Conv_0 + Relu_1
[06/23/2025-11:22:43] [V] [TRT] *************** Autotuning format combination: Half(1296000,1:8,3600,10) -> Float(10368000,129600,360,1) ***************
[06/23/2025-11:22:43] [V] [TRT] Skipping CaskConvolution: No valid tactics for Conv_0 + Relu_1
[06/23/2025-11:22:43] [V] [TRT] Skipping CaskFlattenConvolution: No valid tactics for Conv_0 + Relu_1
[06/23/2025-11:22:43] [V] [TRT] *************** Autotuning format combination: Half(1296000,1:8,3600,10) -> Half(1296000,1:8,3600,10) ***************
[06/23/2025-11:22:43] [V] [TRT] --------------- Timing Runner: Conv_0 + Relu_1 (CaskConvolution[0x80000009])
[06/23/2025-11:22:43] [V] [TRT] Tactic Name: sm80_xmma_fprop_implicit_gemm_f16f16_f16f16_f16_nhwckrsc_nhwc_tilesize128x128x32_stage4_warpsize2x2x1_g1_tensor16x8x16_t1r3s3_aACCESS Tactic: 0x245530c34bd6090f Time: 1.36711
[06/23/2025-11:22:43] [V] [TRT] Tactic Name: sm80_xmma_fprop_implicit_gemm_f16f16_f16f16_f16_nhwckrsc_nhwc_tilesize256x64x32_stage3_warpsize4x1x1_g1_tensor16x8x16_t1r3s3_aACCESS Tactic: 0x0866ddee325d07a6 Time: 1.68961
[06/23/2025-11:22:43] [V] [TRT] Fast skip Tactic:0xa033e20ae9f412b2 which exceed time limit during pre-run
[06/23/2025-11:22:43] [V] [TRT] Tactic Name: sm80_xmma_fprop_implicit_gemm_f16f16_f16f16_f16_nhwckrsc_nhwc_tilesize64x32x64_stage5_warpsize2x2x1_g1_tensor16x8x16_t1r3s3 Tactic: 0xa033e20ae9f412b2 Time: 2.91987
[06/23/2025-11:22:43] [V] [TRT] Fast skip Tactic:0x5820b3dda403c4d0 which exceed time limit during pre-run
[06/23/2025-11:22:43] [V] [TRT] Tactic Name: sm80_xmma_fprop_implicit_gemm_f16f16_f16f16_f16_nhwckrsc_nhwc_tilesize64x32x64_stage5_warpsize2x2x1_g1_tensor16x8x16 Tactic: 0x5820b3dda403c4d0 Time: 2.98106
[06/23/2025-11:22:43] [V] [TRT] Tactic Name: sm80_xmma_fprop_implicit_gemm_f16f16_f16f16_f16_nhwckrsc_nhwc_tilesize128x32x32_stage4_warpsize4x1x1_g1_tensor16x8x16 Tactic: 0x834e11ecd4ab9454 Time: 2.3859
[06/23/2025-11:22:43] [V] [TRT] Tactic Name: sm80_xmma_fprop_implicit_gemm_f16f16_f16f16_f16_nhwckrsc_nhwc_tilesize128x64x32_stage5_warpsize2x2x1_g1_tensor16x8x16 Tactic: 0xbd08239a9317f2fd Time: 1.77627
[06/23/2025-11:22:43] [V] [TRT] Tactic Name: sm80_xmma_fprop_implicit_gemm_f16f16_f16f16_f16_nhwckrsc_nhwc_tilesize128x128x32_stage4_warpsize2x2x1_g1_tensor16x8x16_t1r3s3 Tactic: 0x60c3421152ef8e10 Time: 1.29232
[06/23/2025-11:22:43] [V] [TRT] Tactic Name: sm80_xmma_fprop_implicit_gemm_f16f16_f16f16_f16_nhwckrsc_nhwc_tilesize128x128x32_stage4_warpsize2x2x1_g1_tensor16x8x16 Tactic: 0xdfa020ef435ef810 Time: 1.3001
[06/23/2025-11:22:43] [V] [TRT] Tactic Name: sm80_xmma_fprop_implicit_gemm_f16f16_f16f16_f16_nhwckrsc_nhwc_tilesize128x128x64_stage3_warpsize2x2x1_g1_tensor16x8x16 Tactic: 0x57c9a5ff682354a6 Time: 2.0438
[06/23/2025-11:22:43] [V] [TRT] Fast skip Tactic:0xa9177bbe4e767df8 which exceed time limit during pre-run
[06/23/2025-11:22:43] [V] [TRT] Tactic Name: sm80_xmma_fprop_implicit_gemm_f16f16_f16f16_f16_nhwckrsc_nhwc_tilesize128x256x32_stage3_warpsize2x4x1_g1_tensor16x8x16_t1r3s3 Tactic: 0xa9177bbe4e767df8 Time: 2.72922
[06/23/2025-11:22:43] [V] [TRT] Fast skip Tactic:0xa1a20ea714d420f4 which exceed time limit during pre-run
[06/23/2025-11:22:43] [V] [TRT] Tactic Name: sm80_xmma_fprop_implicit_gemm_f16f16_f16f16_f16_nhwckrsc_nhwc_tilesize128x256x32_stage3_warpsize2x4x1_g1_tensor16x8x16 Tactic: 0xa1a20ea714d420f4 Time: 2.74525
[06/23/2025-11:22:43] [V] [TRT] Tactic Name: sm80_xmma_fprop_implicit_gemm_f16f16_f16f16_f16_nhwckrsc_nhwc_tilesize256x128x64_stage3_warpsize4x2x1_g1_tensor16x8x16_t1r3s3 Tactic: 0xd2fca0486ca97266 Time: 1.88381
[06/23/2025-11:22:43] [V] [TRT] Tactic Name: sm80_xmma_fprop_implicit_gemm_f16f16_f16f16_f16_nhwckrsc_nhwc_tilesize256x128x64_stage3_warpsize4x2x1_g1_tensor16x8x16 Tactic: 0x5a55274960724ba8 Time: 1.8716
[06/23/2025-11:22:43] [V] [TRT] Tactic Name: sm80_xmma_fprop_implicit_gemm_f16f16_f16f16_f16_nhwckrsc_nhwc_tilesize256x128x32_stage3_warpsize4x2x1_g1_tensor16x8x16_t1r3s3 Tactic: 0x048d6d0400f33439 Time: 1.40356
[06/23/2025-11:22:43] [V] [TRT] Tactic Name: sm80_xmma_fprop_implicit_gemm_f16f16_f16f16_f16_nhwckrsc_nhwc_tilesize256x64x64_stage3_warpsize4x1x1_g1_tensor16x8x16 Tactic: 0xeb25062ffb9eae45 Time: 2.18135
[06/23/2025-11:22:43] [V] [TRT] Fast skip Tactic:0xe1ff5ad20f5c6bf6 which exceed time limit during pre-run
[06/23/2025-11:22:43] [V] [TRT] Tactic Name: sm80_xmma_fprop_implicit_gemm_indexed_f16f16_f16f16_f16_nhwckrsc_nhwc_tilesize64x32x64_stage5_warpsize2x2x1_g1_tensor16x8x16 Tactic: 0xe1ff5ad20f5c6bf6 Time: 3.21539
[06/23/2025-11:22:43] [V] [TRT] Tactic Name: sm80_xmma_fprop_implicit_gemm_indexed_f16f16_f16f16_f16_nhwckrsc_nhwc_tilesize128x64x32_stage5_warpsize2x2x1_g1_tensor16x8x16 Tactic: 0xc9d24bd069159fa8 Time: 1.87076
[06/23/2025-11:22:43] [V] [TRT] Tactic Name: sm80_xmma_fprop_implicit_gemm_indexed_f16f16_f16f16_f16_nhwckrsc_nhwc_tilesize128x64x64_stage3_warpsize2x2x1_g1_tensor16x8x16 Tactic: 0x21b295c0c8f6c95a Time: 2.21647
[06/23/2025-11:22:43] [V] [TRT] Tactic Name: sm80_xmma_fprop_implicit_gemm_indexed_f16f16_f16f16_f16_nhwckrsc_nhwc_tilesize128x128x32_stage4_warpsize2x2x1_g1_tensor16x8x16 Tactic: 0x0e07ff4f4f7c1ac9 Time: 1.43983
[06/23/2025-11:22:43] [V] [TRT] Tactic Name: sm80_xmma_fprop_implicit_gemm_indexed_f16f16_f16f16_f16_nhwckrsc_nhwc_tilesize128x128x64_stage3_warpsize2x2x1_g1_tensor16x8x16 Tactic: 0x866e7a5f6401b67f Time: 2.04951
[06/23/2025-11:22:43] [V] [TRT] Fast skip Tactic:0x30e8a8d7a953e5e9 which exceed time limit during pre-run
[06/23/2025-11:22:43] [V] [TRT] Tactic Name: sm80_xmma_fprop_implicit_gemm_f16f16_f16f16_f16_nhwckrsc_nhwc_tilesize64x64x64_stage4_warpsize2x2x1_g1_tensor16x8x16_t1r3s3_aACCESS Tactic: 0x30e8a8d7a953e5e9 Time: 2.73219
[06/23/2025-11:22:43] [V] [TRT] Tactic Name: sm80_xmma_fprop_implicit_gemm_f16f16_f16f16_f16_nhwckrsc_nhwc_tilesize64x64x64_stage4_warpsize2x2x1_g1_tensor16x8x16_t1r3s3 Tactic: 0x31d93dc22d2af081 Time: 2.52939
[06/23/2025-11:22:43] [V] [TRT] Tactic Name: sm80_xmma_fprop_implicit_gemm_indexed_f16f16_f16f16_f16_nhwckrsc_nhwc_tilesize256x32x32_stage4_warpsize4x1x1_g1_tensor16x8x16 Tactic: 0xdce100b9fe609424 Time: 2.18447
[06/23/2025-11:22:44] [V] [TRT] Tactic Name: sm80_xmma_fprop_implicit_gemm_f16f16_f16f16_f16_nhwckrsc_nhwc_tilesize64x64x64_stage4_warpsize2x2x1_g1_tensor16x8x16 Tactic: 0xf35e0311fa1cc516 Time: 2.5092
[06/23/2025-11:22:44] [V] [TRT] Tactic Name: sm80_xmma_fprop_implicit_gemm_indexed_f16f16_f16f16_f16_nhwckrsc_nhwc_tilesize256x128x32_stage3_warpsize4x2x1_g1_tensor16x8x16 Tactic: 0xb17d53d15dfbfc9e Time: 1.43613
[06/23/2025-11:22:44] [V] [TRT] Tactic Name: sm80_xmma_fprop_implicit_gemm_f16f16_f16f16_f16_nhwckrsc_nhwc_tilesize128x64x64_stage4_warpsize2x1x2_g1_tensor16x8x16 Tactic: 0x7273dde1d0cd3bd5 Time: 2.37879
[06/23/2025-11:22:44] [V] [TRT] Tactic Name: sm80_xmma_fprop_implicit_gemm_f16f16_f16f16_f16_nhwckrsc_nhwc_tilesize128x64x32_stage5_warpsize2x2x1_g1_tensor16x8x16_t1r3s3 Tactic: 0xb4bec086187edcfc Time: 1.74024
[06/23/2025-11:22:44] [V] [TRT] Tactic Name: sm80_xmma_fprop_implicit_gemm_indexed_f16f16_f16f16_f16_nhwckrsc_nhwc_tilesize128x32x32_stage4_warpsize4x1x1_g1_tensor16x8x16 Tactic: 0xf79479a62ea9f901 Time: 2.3928
[06/23/2025-11:22:44] [V] [TRT] Tactic Name: sm80_xmma_fprop_implicit_gemm_f16f16_f16f16_f16_nhwckrsc_nhwc_tilesize64x128x32_stage5_warpsize2x2x1_g1_tensor16x8x16_t1r3s3 Tactic: 0x17ebf0c9f418f10a Time: 1.62138
[06/23/2025-11:22:44] [V] [TRT] Tactic Name: sm80_xmma_fprop_implicit_gemm_f16f16_f16f16_f16_nhwckrsc_nhwc_tilesize128x64x64_stage3_warpsize2x2x1_g1_tensor16x8x16_t1r3s3 Tactic: 0x05b6220f243edacd Time: 1.94539
[06/23/2025-11:22:44] [V] [TRT] Tactic Name: sm80_xmma_fprop_implicit_gemm_indexed_f16f16_f16f16_f16_nhwckrsc_nhwc_tilesize256x64x64_stage3_warpsize4x1x1_g1_tensor16x8x16 Tactic: 0x9fff6e65019cc310 Time: 2.27752
[06/23/2025-11:22:44] [V] [TRT] Tactic Name: sm80_xmma_fprop_implicit_gemm_f16f16_f16f16_f16_nhwckrsc_nhwc_tilesize128x64x64_stage3_warpsize2x2x1_g1_tensor16x8x16 Tactic: 0x5568fd8a32f4a40f Time: 1.96917
[06/23/2025-11:22:44] [V] [TRT] Tactic Name: sm80_xmma_fprop_implicit_gemm_f16f16_f16f16_f16_nhwckrsc_nhwc_tilesize64x64x64_stage4_warpsize2x1x2_g1_tensor16x8x16_aACCESS Tactic: 0x841c601dec2a75bc Time: 2.51272
[06/23/2025-11:22:44] [V] [TRT] Tactic Name: sm80_xmma_fprop_implicit_gemm_f16f16_f16f16_f16_nhwckrsc_nhwc_tilesize128x64x64_stage5_warpsize2x1x2_g1_tensor16x8x16_aACCESS Tactic: 0x8bfc020aee55171f Time: 2.45472
[06/23/2025-11:22:44] [V] [TRT] Tactic Name: sm80_xmma_fprop_implicit_gemm_f16f16_f16f16_f16_nhwckrsc_nhwc_tilesize256x64x64_stage3_warpsize4x1x1_g1_tensor16x8x16_t1r3s3 Tactic: 0x84ee897dd1f4d2aa Time: 2.14262
[06/23/2025-11:22:44] [V] [TRT] Tactic Name: sm80_xmma_fprop_implicit_gemm_f16f16_f16f16_f16_nhwckrsc_nhwc_tilesize256x64x32_stage3_warpsize4x1x1_g1_tensor16x8x16 Tactic: 0xd1aaad17ca35fbaa Time: 1.53892
[06/23/2025-11:22:44] [V] [TRT] Tactic Name: sm80_xmma_fprop_implicit_gemm_f16f16_f16f16_f16_nhwckrsc_nhwc_tilesize256x128x32_stage3_warpsize4x2x1_g1_tensor16x8x16 Tactic: 0x60da8c7151d91e47 Time: 1.41834
[06/23/2025-11:22:44] [V] [TRT] Tactic Name: sm80_xmma_fprop_implicit_gemm_indexed_f16f16_f16f16_f16_nhwckrsc_nhwc_tilesize256x128x64_stage3_warpsize4x2x1_g1_tensor16x8x16 Tactic: 0x8bf2f8e96c50a971 Time: 1.84444
[06/23/2025-11:22:44] [V] [TRT] Tactic Name: sm80_xmma_fprop_implicit_gemm_f16f16_f16f16_f16_nhwckrsc_nhwc_tilesize64x128x32_stage5_warpsize2x2x1_g1_tensor16x8x16 Tactic: 0xdb0b80f591d1bb6d Time: 1.59204
[06/23/2025-11:22:44] [V] [TRT] Fast skip Tactic:0xded5318b4a444b84 which exceed time limit during pre-run
[06/23/2025-11:22:44] [V] [TRT] Tactic Name: sm80_xmma_fprop_wngd_f16f16_f16_f16_nhwckrsc_nhwc_tilesize8x16x32x32_warpsize8x1x1_wngd2x2 Tactic: 0xded5318b4a444b84 Time: 3.48477
[06/23/2025-11:22:44] [V] [TRT] Tactic Name: sm80_xmma_fprop_implicit_gemm_f16f16_f16f16_f16_nhwckrsc_nhwc_tilesize256x32x32_stage4_warpsize4x1x1_g1_tensor16x8x16 Tactic: 0xa83b68f30462f971 Time: 2.18464
[06/23/2025-11:22:44] [V] [TRT] Fast skip Tactic:0x4a81ea1e51436a30 which exceed time limit during pre-run
[06/23/2025-11:22:44] [V] [TRT] Tactic Name: sm80_xmma_fprop_implicit_gemm_indexed_f16f16_f16f16_f16_nhwckrsc_nhwc_tilesize64x64x64_stage4_warpsize2x2x1_g1_tensor16x8x16 Tactic: 0x4a81ea1e51436a30 Time: 2.94374
[06/23/2025-11:22:44] [V] [TRT] Tactic Name: sm80_xmma_fprop_implicit_gemm_f16f16_f16f16_f16_nhwckrsc_nhwc_tilesize128x128x64_stage3_warpsize2x2x1_g1_tensor16x8x16_t1r3s3 Tactic: 0xc0a02dc6095497cc Time: 2.03315
[06/23/2025-11:22:44] [V] [TRT] Tactic Name: sm80_xmma_fprop_implicit_gemm_f16f16_f16f16_f16_nhwckrsc_nhwc_tilesize128x32x32_stage4_warpsize4x1x1_g1_tensor16x8x16_t1r3s3 Tactic: 0x3e7eb35b91b9fa63 Time: 2.3843
[06/23/2025-11:22:44] [V] [TRT] Tactic Name: sm80_xmma_fprop_implicit_gemm_indexed_f16f16_f16f16_f16_nhwckrsc_nhwc_tilesize256x64x32_stage3_warpsize4x1x1_g1_tensor16x8x16 Tactic: 0xa570c55d303796ff Time: 1.55688
[06/23/2025-11:22:44] [V] [TRT] Fast skip Tactic:0x29dc14520e0e4eb6 which exceed time limit during pre-run
[06/23/2025-11:22:44] [V] [TRT] Tactic Name: sm80_xmma_fprop_implicit_gemm_f16f16_f16f16_f16_nhwckrsc_nhwc_tilesize64x256x64_stage3_warpsize1x4x1_g1_tensor16x8x16 Tactic: 0x29dc14520e0e4eb6 Time: 4.05469
[06/23/2025-11:22:44] [V] [TRT] Tactic Name: sm80_xmma_fprop_implicit_gemm_indexed_f16f16_f16f16_f16_nhwckrsc_nhwc_tilesize64x128x32_stage5_warpsize2x2x1_g1_tensor16x8x16 Tactic: 0xafd1e8bf6bd3d638 Time: 1.69808
[06/23/2025-11:22:44] [V] [TRT] Tactic Name: sm80_xmma_fprop_wngd_f16f16_f16_f16_nhwckrsc_nhwc_tilesize16x16x64x16_warpsize8x1x1_wngd2x2 Tactic: 0xe29800439b9d3cf7 Time: 2.28577
[06/23/2025-11:22:44] [V] [TRT] Fast skip Tactic:0x7005d10718f6c22d which exceed time limit during pre-run
[06/23/2025-11:22:44] [V] [TRT] Tactic Name: sm80_xmma_fprop_implicit_gemm_indexed_f16f16_f16f16_f16_nhwckrsc_nhwc_tilesize128x256x32_stage3_warpsize2x4x1_g1_tensor16x8x16 Tactic: 0x7005d10718f6c22d Time: 2.74982
[06/23/2025-11:22:44] [V] [TRT] Fast skip Tactic:0xd7c261fa01db2af9 which exceed time limit during pre-run
[06/23/2025-11:22:44] [V] [TRT] Tactic Name: sm80_xmma_fprop_implicit_gemm_f16f16_f16f16_f16_nhwckrsc_nhwc_tilesize64x256x64_stage3_warpsize1x4x1_g1_tensor16x8x16_t1r3s3 Tactic: 0xd7c261fa01db2af9 Time: 4.03658
[06/23/2025-11:22:44] [V] [TRT] Tactic Name: sm80_xmma_fprop_implicit_gemm_f16f16_f16f16_f16_nhwckrsc_nhwc_tilesize256x64x32_stage3_warpsize4x1x1_g1_tensor16x8x16_t1r3s3 Tactic: 0x529f4431bdae94f5 Time: 1.54091
[06/23/2025-11:22:44] [V] [TRT] Tactic Name: sm80_xmma_fprop_implicit_gemm_f16f16_f16f16_f16_nhwckrsc_nhwc_tilesize256x32x32_stage4_warpsize4x1x1_g1_tensor16x8x16_t1r3s3 Tactic: 0xa40cb43c296a36a8 Time: 2.19058
[06/23/2025-11:22:44] [V] [TRT] Fast skip Tactic:0x5d067c18f40c23e3 which exceed time limit during pre-run
[06/23/2025-11:22:44] [V] [TRT] Tactic Name: sm80_xmma_fprop_implicit_gemm_indexed_f16f16_f16f16_f16_nhwckrsc_nhwc_tilesize64x256x64_stage3_warpsize1x4x1_g1_tensor16x8x16 Tactic: 0x5d067c18f40c23e3 Time: 4.11226
[06/23/2025-11:22:44] [V] [TRT] Tactic Name: sm80_xmma_fprop_implicit_gemm_f16f16_f16f16_f16_nhwckrsc_nhwc_tilesize128x64x64_stage3_warpsize2x2x1_g1_tensor16x8x16_t1r3s3_aACCESS Tactic: 0x263a38afd75e3a43 Time: 2.21058
[06/23/2025-11:22:44] [V] [TRT] Conv_0 + Relu_1 (CaskConvolution[0x80000009]) profiling completed in 1.45383 seconds. Fastest Tactic: 0x60c3421152ef8e10 Time: 1.29232
[06/23/2025-11:22:44] [V] [TRT] Skipping CaskFlattenConvolution: No valid tactics for Conv_0 + Relu_1
[06/23/2025-11:22:44] [V] [TRT] >>>>>>>>>>>>>>> Chose Runner Type: CaskConvolution Tactic: 0x60c3421152ef8e10
[06/23/2025-11:22:44] [V] [TRT] =============== Computing costs for Conv_2 + Relu_3
[06/23/2025-11:22:44] [V] [TRT] *************** Autotuning format combination: Float(10368000,129600,360,1) -> Float(2592000,32400,180,1) ***************
[06/23/2025-11:22:44] [V] [TRT] --------------- Timing Runner: Conv_2 + Relu_3 (CaskConvolution[0x80000009])
[06/23/2025-11:22:44] [V] [TRT] Tactic Name: ampere_scudnn_128x128_relu_small_nn_v1 Tactic: 0x503619c69ae500ff Time: 2.91589
[06/23/2025-11:22:44] [V] [TRT] Tactic Name: ampere_scudnn_128x128_relu_medium_nn_v1 Tactic: 0xf067e6205da31c2e Time: 2.95629
[06/23/2025-11:22:45] [V] [TRT] Tactic Name: ampere_scudnn_128x64_relu_xregs_large_nn_v1 Tactic: 0x5deb29b7a8e275f7 Time: 3.16576
[06/23/2025-11:22:45] [V] [TRT] Tactic Name: sm80_xmma_fprop_implicit_gemm_indexed_f32f32_f32f32_f32_nchwkcrs_nchw_tilesize128x64x8_stage2_warpsize2x2x1_g1_ffma_aligna4_alignc4_beta0_packed_stride Tactic: 0x31aa67f57c5aea77 Time: 3.94239
[06/23/2025-11:22:45] [V] [TRT] Tactic Name: sm80_xmma_fprop_implicit_gemm_f32f32_f32f32_f32_nchwkcrs_nchw_tilesize64x64x8_stage3_warpsize1x4x1_g1_ffma_aligna4_alignc4 Tactic: 0xa31d27de74b895ff Time: 3.32499
[06/23/2025-11:22:45] [V] [TRT] Tactic Name: sm80_xmma_fprop_implicit_gemm_indexed_f32f32_f32f32_f32_nchwkcrs_nchw_tilesize128x32x8_stage3_warpsize2x2x1_g1_ffma_aligna4_alignc4 Tactic: 0xa9366041633a5135 Time: 4.44763
[06/23/2025-11:22:45] [V] [TRT] Tactic Name: sm80_xmma_fprop_implicit_gemm_f32f32_f32f32_f32_nchwkcrs_nchw_tilesize64x128x8_stage3_warpsize1x4x1_g1_ffma_aligna4_alignc4 Tactic: 0x5aa723e0481da855 Time: 3.50895
[06/23/2025-11:22:45] [V] [TRT] Tactic Name: ampere_scudnn_128x64_relu_small_nn_v1 Tactic: 0x3f243c490d502deb Time: 3.30668
[06/23/2025-11:22:45] [V] [TRT] Tactic Name: sm80_xmma_fprop_implicit_gemm_f32f32_f32f32_f32_nchwkcrs_nchw_tilesize64x128x8_stage3_warpsize1x4x1_g1_ffma_t1r3s3_aligna4_alignc4 Tactic: 0x01cf8ce2da913006 Time: 2.82808
[06/23/2025-11:22:45] [V] [TRT] Tactic Name: sm80_xmma_fprop_implicit_gemm_f32f32_f32f32_f32_nchwkcrs_nchw_tilesize128x64x8_stage2_warpsize2x2x1_g1_ffma_t1r3s3_aligna4_alignc4_beta0_packed_stride Tactic: 0x3712e3e595645874 Time: 3.11205
[06/23/2025-11:22:45] [V] [TRT] Tactic Name: sm80_xmma_fprop_implicit_gemm_f32f32_f32f32_f32_nchwkcrs_nchw_tilesize32x32x8_stage3_warpsize1x2x1_g1_ffma_t1r3s3_aligna4_alignc4 Tactic: 0x8ad32616b1424be4 Time: 3.35836
[06/23/2025-11:22:45] [V] [TRT] Tactic Name: sm80_xmma_fprop_implicit_gemm_f32f32_f32f32_f32_nchwkcrs_nchw_tilesize64x64x8_stage3_warpsize1x4x1_g1_ffma_t1r3s3_aligna4_alignc4 Tactic: 0x4727434768e46395 Time: 3.26259
[06/23/2025-11:22:45] [V] [TRT] Tactic Name: sm80_xmma_fprop_implicit_gemm_f32f32_f32f32_f32_nchwkcrs_nchw_tilesize256x128x8_stage3_warpsize4x2x1_g1_ffma_t1r3s3_aligna4_alignc4 Tactic: 0x4efce38acc876f5c Time: 2.5967
[06/23/2025-11:22:45] [V] [TRT] Tactic Name: sm80_xmma_fprop_implicit_gemm_indexed_f32f32_f32f32_f32_nchwkcrs_nchw_tilesize128x64x8_stage2_warpsize4x1x1_g1_ffma_aligna4_alignc4_beta0_packed_stride Tactic: 0x1673e3594ce11cea Time: 4.50286
[06/23/2025-11:22:45] [V] [TRT] Fast skip Tactic:0x40a12e3938221818 which exceed time limit during pre-run
[06/23/2025-11:22:45] [V] [TRT] Tactic Name: sm80_xmma_fprop_implicit_gemm_indexed_f32f32_f32f32_f32_nchwkcrs_nchw_tilesize128x16x8_stage3_warpsize4x1x1_g1_ffma_aligna4_alignc4 Tactic: 0x40a12e3938221818 Time: 5.89139
[06/23/2025-11:22:45] [V] [TRT] Tactic Name: sm80_xmma_fprop_implicit_gemm_indexed_f32f32_f32f32_f32_nchwkcrs_nchw_tilesize32x32x8_stage3_warpsize1x2x1_g1_ffma_aligna4_alignc4 Tactic: 0xcb8a43f748d8a338 Time: 4.71571
[06/23/2025-11:22:45] [V] [TRT] Tactic Name: sm80_xmma_fprop_implicit_gemm_indexed_f32f32_f32f32_f32_nchwkcrs_nchw_tilesize128x64x8_stage2_warpsize1x4x1_g1_ffma_aligna4_alignc4_beta0_packed_stride Tactic: 0xede36641840ce3d2 Time: 4.33154
[06/23/2025-11:22:45] [V] [TRT] Tactic Name: sm80_xmma_fprop_implicit_gemm_f32f32_f32f32_f32_nchwkcrs_nchw_tilesize128x16x8_stage3_warpsize4x1x1_g1_ffma_aligna4_alignc4 Tactic: 0x9d9fdb5fd9945f64 Time: 3.63746
[06/23/2025-11:22:45] [V] [TRT] Tactic Name: sm80_xmma_fprop_implicit_gemm_f32f32_f32f32_f32_nchwkcrs_nchw_tilesize256x128x8_stage3_warpsize4x2x1_g1_ffma_aligna4_alignc4 Tactic: 0xbb8c3889c7eacd30 Time: 2.61021
[06/23/2025-11:22:45] [V] [TRT] Tactic Name: sm80_xmma_fprop_implicit_gemm_f32f32_f32f32_f32_nchwkcrs_nchw_tilesize128x64x8_stage2_warpsize1x4x1_g1_ffma_t1r3s3_aligna4_alignc4_beta0_packed_stride Tactic: 0x7fc93550f5b9c127 Time: 3.41752
[06/23/2025-11:22:45] [V] [TRT] Tactic Name: sm80_xmma_fprop_implicit_gemm_indexed_f32f32_f32f32_f32_nchwkcrs_nchw_tilesize64x64x8_stage3_warpsize1x4x1_g1_ffma_aligna4_alignc4 Tactic: 0xd828f024626fa982 Time: 4.27083
[06/23/2025-11:22:45] [V] [TRT] Tactic Name: sm80_xmma_fprop_implicit_gemm_f32f32_f32f32_f32_nchwkcrs_nchw_tilesize128x64x8_stage2_warpsize4x1x1_g1_ffma_t1r3s3_aligna4_alignc4_beta0_packed_stride Tactic: 0xe640ceafd7d34ca9 Time: 3.61366
[06/23/2025-11:22:45] [V] [TRT] Tactic Name: sm80_xmma_fprop_implicit_gemm_f32f32_f32f32_f32_nchwkcrs_nchw_tilesize32x32x8_stage3_warpsize1x2x1_g1_ffma_aligna4_alignc4 Tactic: 0xb0bf940d5e0f9f45 Time: 3.39932
[06/23/2025-11:22:45] [V] [TRT] Tactic Name: ampere_scudnn_128x32_relu_small_nn_v1 Tactic: 0xa8609adc4e0ceb90 Time: 2.7787
[06/23/2025-11:22:46] [V] [TRT] Tactic Name: sm80_xmma_fprop_implicit_gemm_f32f32_f32f32_f32_nchwkcrs_nchw_tilesize128x64x8_stage3_warpsize2x2x1_g1_ffma_aligna4_alignc4 Tactic: 0x12dbf7d94ee3696d Time: 3.16215
[06/23/2025-11:22:46] [V] [TRT] Tactic Name: ampere_scudnn_128x64_relu_medium_nn_v1 Tactic: 0xf64396b97c889179 Time: 3.3685
[06/23/2025-11:22:46] [V] [TRT] Conv_2 + Relu_3 (CaskConvolution[0x80000009]) profiling completed in 1.21686 seconds. Fastest Tactic: 0x4efce38acc876f5c Time: 2.5967
[06/23/2025-11:22:46] [V] [TRT] Skipping CaskFlattenConvolution: No valid tactics for Conv_2 + Relu_3
[06/23/2025-11:22:46] [V] [TRT] >>>>>>>>>>>>>>> Chose Runner Type: CaskConvolution Tactic: 0x4efce38acc876f5c
[06/23/2025-11:22:46] [V] [TRT] *************** Autotuning format combination: Float(10368000,1,28800,80) -> Float(2592000,1,14400,80) ***************
[06/23/2025-11:22:46] [V] [TRT] --------------- Timing Runner: Conv_2 + Relu_3 (CaskConvolution[0x80000009])
[06/23/2025-11:22:46] [V] [TRT] Tactic Name: sm80_xmma_fprop_implicit_gemm_f32f32_f32f32_f32_nhwckrsc_nhwc_tilesize64x64x8_stage3_warpsize1x4x1_g1_ffma_t1r3s3_aligna4_alignc4 Tactic: 0x94a7db94ba744c45 Time: 3.01074
[06/23/2025-11:22:46] [V] [TRT] Tactic Name: sm80_xmma_fprop_implicit_gemm_f32f32_f32f32_f32_nhwckrsc_nhwc_tilesize128x64x8_stage3_warpsize2x2x1_g1_ffma_t1r3s3_aligna4_alignc4 Tactic: 0xf48db81f02eca9ee Time: 2.83774
[06/23/2025-11:22:46] [V] [TRT] Tactic Name: sm80_xmma_fprop_implicit_gemm_f32f32_f32f32_f32_nhwckrsc_nhwc_tilesize64x256x8_stage3_warpsize1x4x1_g1_ffma_t1r3s3_aligna4_alignc4 Tactic: 0x3f0c846d6379bc98 Time: 4.94156
[06/23/2025-11:22:46] [V] [TRT] Tactic Name: sm80_xmma_fprop_implicit_gemm_indexed_f32f32_f32f32_f32_nhwckrsc_nhwc_tilesize32x32x8_stage3_warpsize1x2x1_g1_ffma_aligna4_alignc4 Tactic: 0x0a143be7a52f301a Time: 3.83927
[06/23/2025-11:22:46] [V] [TRT] Tactic Name: sm80_xmma_fprop_implicit_gemm_f32f32_f32f32_f32_nhwckrsc_nhwc_tilesize64x128x8_stage3_warpsize1x4x1_g1_ffma_t1r3s3_aligna4_alignc4 Tactic: 0xd15dd11d64344e83 Time: 2.76846
[06/23/2025-11:22:46] [V] [TRT] Tactic Name: sm80_xmma_fprop_implicit_gemm_f32f32_f32f32_f32_nhwckrsc_nhwc_tilesize128x64x8_stage3_warpsize2x2x1_g1_ffma_aligna4_alignc4 Tactic: 0x1da91d865428f237 Time: 2.86336
[06/23/2025-11:22:46] [V] [TRT] Tactic Name: sm80_xmma_fprop_implicit_gemm_f32f32_f32f32_f32_nhwckrsc_nhwc_tilesize128x16x8_stage3_warpsize4x1x1_g1_ffma_aligna4_alignc4 Tactic: 0x92ed3100c35fc43e Time: 3.44555
[06/23/2025-11:22:46] [V] [TRT] Tactic Name: sm80_xmma_fprop_implicit_gemm_indexed_f32f32_f32f32_f32_nhwckrsc_nhwc_tilesize128x32x8_stage3_warpsize2x2x1_g1_ffma_aligna4_alignc4 Tactic: 0xa6448a1e79f1ca6f Time: 2.91587
[06/23/2025-11:22:46] [V] [TRT] Tactic Name: sm80_xmma_fprop_implicit_gemm_f32f32_f32f32_f32_nhwckrsc_nhwc_tilesize256x64x8_stage3_warpsize2x2x1_g1_ffma_aligna4_alignc4 Tactic: 0x8014228ec08b4d49 Time: 2.66091
[06/23/2025-11:22:46] [V] [TRT] Tactic Name: sm80_xmma_fprop_implicit_gemm_f32f32_f32f32_f32_nhwckrsc_nhwc_tilesize64x64x8_stage3_warpsize1x4x1_g1_ffma_aligna4_alignc4 Tactic: 0x62835fce994f06dd Time: 2.99475
[06/23/2025-11:22:46] [V] [TRT] Tactic Name: sm80_xmma_fprop_implicit_gemm_indexed_f32f32_f32f32_f32_nhwckrsc_nhwc_tilesize128x16x8_stage3_warpsize4x1x1_g1_ffma_aligna4_alignc4 Tactic: 0x4fd3c46622e98342 Time: 3.84265
[06/23/2025-11:22:46] [V] [TRT] Tactic Name: sm80_xmma_fprop_implicit_gemm_f32f32_f32f32_f32_nhwckrsc_nhwc_tilesize128x16x8_stage3_warpsize4x1x1_g1_ffma_t1r3s3_aligna4_alignc4 Tactic: 0x32059de4888dfdda Time: 3.43359
[06/23/2025-11:22:46] [V] [TRT] Tactic Name: sm80_xmma_fprop_implicit_gemm_indexed_f32f32_f32f32_f32_nhwckrsc_nhwc_tilesize64x64x8_stage3_warpsize1x4x1_g1_ffma_aligna4_alignc4 Tactic: 0x19b688348f983aa0 Time: 3.38432
[06/23/2025-11:22:46] [V] [TRT] Tactic Name: sm80_xmma_fprop_implicit_gemm_f32f32_f32f32_f32_nhwckrsc_nhwc_tilesize32x32x8_stage3_warpsize1x2x1_g1_ffma_t1r3s3_aligna4_alignc4 Tactic: 0x5953bec563d26434 Time: 3.56653
[06/23/2025-11:22:46] [V] [TRT] Tactic Name: sm80_xmma_fprop_implicit_gemm_f32f32_f32f32_f32_nhwckrsc_nhwc_tilesize32x32x8_stage3_warpsize1x2x1_g1_ffma_aligna4_alignc4 Tactic: 0x7121ec1db3f80c67 Time: 3.56275
[06/23/2025-11:22:46] [V] [TRT] Conv_2 + Relu_3 (CaskConvolution[0x80000009]) profiling completed in 0.683812 seconds. Fastest Tactic: 0x8014228ec08b4d49 Time: 2.66091
[06/23/2025-11:22:46] [V] [TRT] Skipping CaskFlattenConvolution: No valid tactics for Conv_2 + Relu_3
[06/23/2025-11:22:46] [V] [TRT] >>>>>>>>>>>>>>> Chose Runner Type: CaskConvolution Tactic: 0x8014228ec08b4d49
[06/23/2025-11:22:46] [V] [TRT] *************** Autotuning format combination: Float(2592000,1:4,7200,20) -> Float(2592000,32400,180,1) ***************
[06/23/2025-11:22:46] [V] [TRT] --------------- Timing Runner: Conv_2 + Relu_3 (CaskConvolution[0x80000009])
[06/23/2025-11:22:46] [V] [TRT] Tactic Name: sm80_xmma_fprop_implicit_gemm_f32f32_tf32f32_f32_nhwckrsc_nchw_tilesize128x128x32_stage4_warpsize2x2x1_g1_tensor16x8x8_t1r3s3 Tactic: 0xd7390b594d1ce947 Time: 0.805541
[06/23/2025-11:22:46] [V] [TRT] Tactic Name: sm80_xmma_fprop_implicit_gemm_indexed_f32f32_tf32f32_f32_nhwckrsc_nchw_tilesize128x256x32_stage3_warpsize2x4x1_g1_tensor16x8x8 Tactic: 0xcd6c525a3239bae9 Time: 1.41759
[06/23/2025-11:22:46] [V] [TRT] Fast skip Tactic:0xd106f5c552452296 which exceed time limit during pre-run
[06/23/2025-11:22:46] [V] [TRT] Tactic Name: sm80_xmma_fprop_implicit_gemm_f32f32_tf32f32_f32_nhwckrsc_nchw_tilesize64x32x64_stage5_warpsize2x2x1_g1_tensor16x8x8_t1r3s3_alignc4 Tactic: 0xd106f5c552452296 Time: 2.02538
[06/23/2025-11:22:46] [V] [TRT] Tactic Name: sm80_xmma_fprop_implicit_gemm_f32f32_tf32f32_f32_nhwckrsc_nchw_tilesize128x64x32_stage5_warpsize2x2x1_g1_tensor16x8x8_alignc4 Tactic: 0x294c501bad19317c Time: 1.17872
[06/23/2025-11:22:46] [V] [TRT] Tactic Name: sm80_xmma_fprop_implicit_gemm_f32f32_tf32f32_f32_nhwckrsc_nchw_tilesize128x64x64_stage3_warpsize2x2x1_g1_tensor16x8x8_t1r3s3_alignc4 Tactic: 0x14ce6e2746cfbad7 Time: 1.43501
[06/23/2025-11:22:46] [V] [TRT] Tactic Name: sm80_xmma_fprop_implicit_gemm_f32f32_tf32f32_f32_nhwckrsc_nchw_tilesize128x128x16_stage4_warpsize2x2x1_g1_tensor16x8x8_t1r3s3_alignc4 Tactic: 0x1323e48791e2f671 Time: 0.702304
[06/23/2025-11:22:46] [V] [TRT] Tactic Name: sm80_xmma_fprop_implicit_gemm_f32f32_tf32f32_f32_nhwckrsc_nchw_tilesize128x128x16_stage4_warpsize2x2x1_g1_tensor16x8x8_alignc4 Tactic: 0x9fd9fe001908ce2e Time: 0.718583
[06/23/2025-11:22:46] [V] [TRT] Tactic Name: sm80_xmma_fprop_implicit_gemm_f32f32_tf32f32_f32_nhwckrsc_nchw_tilesize128x128x32_stage4_warpsize2x2x1_g1_tensor16x8x8_t1r3s3_alignc4 Tactic: 0xc50ec1760635de6f Time: 0.805413
[06/23/2025-11:22:46] [V] [TRT] Fast skip Tactic:0xf5c5ffdea9383daa which exceed time limit during pre-run
[06/23/2025-11:22:46] [V] [TRT] Tactic Name: sm80_xmma_fprop_implicit_gemm_f32f32_tf32f32_f32_nhwckrsc_nchw_tilesize64x32x64_stage5_warpsize2x2x1_g1_tensor16x8x8_t1r3s3 Tactic: 0xf5c5ffdea9383daa Time: 2.0255
[06/23/2025-11:22:47] [V] [TRT] Fast skip Tactic:0xbfdf05725bf3ea6d which exceed time limit during pre-run
[06/23/2025-11:22:47] [V] [TRT] Tactic Name: sm80_xmma_fprop_implicit_gemm_f32f32_tf32f32_f32_nhwckrsc_nchw_tilesize64x64x64_stage4_warpsize2x2x1_g1_tensor16x8x8_t1r3s3 Tactic: 0xbfdf05725bf3ea6d Time: 1.78896
[06/23/2025-11:22:47] [V] [TRT] Tactic Name: sm80_xmma_fprop_implicit_gemm_f32f32_tf32f32_f32_nhwckrsc_nchw_tilesize128x64x32_stage5_warpsize2x2x1_g1_tensor16x8x8 Tactic: 0xa95e2a26416587cd Time: 1.10703
[06/23/2025-11:22:47] [V] [TRT] Tactic Name: sm80_xmma_fprop_implicit_gemm_f32f32_tf32f32_f32_nhwckrsc_nchw_tilesize256x128x32_stage3_warpsize4x2x1_g1_tensor16x8x8_t1r3s3 Tactic: 0x2f3dd4e092216107 Time: 0.797138
[06/23/2025-11:22:47] [V] [TRT] Tactic Name: sm80_xmma_fprop_implicit_gemm_indexed_f32f32_tf32f32_f32_nhwckrsc_nchw_tilesize128x128x16_stage4_warpsize2x2x1_g1_tensor16x8x8_alignc4 Tactic: 0xe8f7b6a5bab325f8 Time: 0.739753
[06/23/2025-11:22:47] [V] [TRT] Fast skip Tactic:0xbf7080aca6804022 which exceed time limit during pre-run
[06/23/2025-11:22:47] [V] [TRT] Tactic Name: sm80_xmma_fprop_implicit_gemm_indexed_f32f32_tf32f32_f32_nhwckrsc_nchw_tilesize128x256x32_stage3_warpsize2x4x1_g1_tensor16x8x8_alignc4 Tactic: 0xbf7080aca6804022 Time: 1.41776
[06/23/2025-11:22:47] [V] [TRT] Tactic Name: sm80_xmma_fprop_implicit_gemm_f32f32_tf32f32_f32_nhwckrsc_nchw_tilesize64x128x32_stage5_warpsize2x2x1_g1_tensor16x8x8_t1r3s3 Tactic: 0xec566784128c4eda Time: 1.1058
[06/23/2025-11:22:47] [V] [TRT] Tactic Name: sm80_xmma_fprop_implicit_gemm_indexed_f32f32_tf32f32_f32_nhwckrsc_nchw_tilesize128x128x16_stage4_warpsize2x2x1_g1_tensor16x8x8 Tactic: 0xe0a307ffe0ffb6a5 Time: 0.841687
[06/23/2025-11:22:47] [V] [TRT] Tactic Name: sm80_xmma_fprop_implicit_gemm_indexed_f32f32_tf32f32_f32_nhwckrsc_nchw_tilesize256x64x32_stage3_warpsize4x2x1_g1_tensor16x8x8 Tactic: 0x7449ed93fb7feabf Time: 1.19502
[06/23/2025-11:22:47] [V] [TRT] Tactic Name: sm80_xmma_fprop_implicit_gemm_f32f32_tf32f32_f32_nhwckrsc_nchw_tilesize128x128x32_stage4_warpsize2x2x1_g1_tensor16x8x8 Tactic: 0xa0f5a3abd9b9c82a Time: 0.917472
[06/23/2025-11:22:47] [V] [TRT] Tactic Name: sm80_xmma_fprop_implicit_gemm_f32f32_tf32f32_f32_nhwckrsc_nchw_tilesize256x64x32_stage3_warpsize4x2x1_g1_tensor16x8x8 Tactic: 0x009385d9017d87ea Time: 1.11882
[06/23/2025-11:22:47] [V] [TRT] Tactic Name: sm80_xmma_fprop_implicit_gemm_f32f32_tf32f32_f32_nhwckrsc_nchw_tilesize64x128x32_stage5_warpsize2x2x1_g1_tensor16x8x8 Tactic: 0xabbf7eb3b5b99502 Time: 1.23982
[06/23/2025-11:22:47] [V] [TRT] Fast skip Tactic:0x6f57319253e043c7 which exceed time limit during pre-run
[06/23/2025-11:22:47] [V] [TRT] Tactic Name: sm80_xmma_fprop_implicit_gemm_f32f32_tf32f32_f32_nhwckrsc_nchw_tilesize128x256x32_stage3_warpsize2x4x1_g1_tensor16x8x8_t1r3s3 Tactic: 0x6f57319253e043c7 Time: 1.55987
[06/23/2025-11:22:47] [V] [TRT] Tactic Name: sm80_xmma_fprop_implicit_gemm_f32f32_tf32f32_f32_nhwckrsc_nchw_tilesize128x64x32_stage5_warpsize2x2x1_g1_tensor16x8x8_t1r3s3_alignc4 Tactic: 0x2bf0858f240ff918 Time: 1.29422
[06/23/2025-11:22:47] [V] [TRT] Tactic Name: sm80_xmma_fprop_implicit_gemm_f32f32_tf32f32_f32_nhwckrsc_nchw_tilesize64x128x32_stage5_warpsize2x2x1_g1_tensor16x8x8_alignc4 Tactic: 0x8a196054417f1c8a Time: 1.38645
